NewsID,label,Text Length,Summary Length,Readability Score,Keyword Frequency,Title Length,Named Entities,num_nouns,num_propernouns,num_determinants,num_adverbs,num_interjections,num_verbs,num_adjectives,punctuation_count,TotalShares,UniqueUserShares,image_present,image_count
128,PolitiFact_Fake_8,559,30,9.6,0,12,"Mike, Pence, Michelle, Obama, Donald, Trump, First, Lady, Republican, ”, ”, “, First, Pence, Mrs., Obama, White, House, President, United, God-willing, First, Lady, Indiana, ”, “, ‘, ’, ’, Michelle, Obama, Donald, Trump, American, ”, “, How, Pence, New, York, Times, Donald, Michelle, Obama, ’, New, York, Times, Donald, Trump, Donald, Trump, Democratic, Party, Michelle, Obama, ’, Donald, Pence",83,59,50,45,0,133,45,62,1029,785,1,10
129,PolitiFact_Fake_9,539,28,12.0,0,16,"Mall, America, Santa, Claus, Fox, ’, Megyn, Kelly, America, Jesus, Christ, Santa, Claus, Mall, America, Larry, Jefferson, U.S., Army, Irving, Texas, Alaska, Sarah, Palin, Republican, ’, Mall, America, Santa, “, Bible., ”, “, No, ”, Palin, Minneapolis, Star-Tribune, Santa, Claus, America, ’, Christian, ”, ’, ’, Christian, ”, ’, ”, Palin, Holy, Book, Santa, Claus, Mall, America, Arab, Santa, Clauses, IEDs, Christmas, ’, “, Nope, Christianity, Islam, Santa",55,68,45,26,0,121,53,61,71,59,1,10
130,PolitiFact_Fake_10,367,20,12.9,0,11,"Huffington, Post, Washington, Post, CIA, “, HILLARY, IN, THE, WHITE, HOUSE, HuffPo, Pennsylvania, Clinton, Friday, Donald, Trump, ’, Clinton, Friday, Washington, Post, Donald, Trump, Hillary, Clinton, CIA, President, Obama, Clinton, Article, II, U.S., Constitution, Congress, Electoral, College, December, Electoral, College, Clinton, Trump, Hamilton, ’, Electoral, College, Mr., Trump, ’, Electoral, College, Clinton, Donald, Trump, Electoral, College, Clinton, House",55,58,39,7,0,56,39,39,5,5,1,2
131,PolitiFact_Fake_11,420,0,11.5,0,11,"Obama, ’, Christmas, Pentagon, White, House, Christmas, Muslims, Per, Christmas, Jesus, Christ, Muslims, Army, Veteran, Fox, News, Pentagon, ’, U.S., Military, Muslims., ”, Muslims, God, Christ, Jesus, Christianity, Liberty, Institute, White, House, Christmas, Liberty, Institute, ’, Director, Litigation, Hyman, Stratcher, Obama, Christmas, Imam, Al-Suq, Akweer, Islamic, Friendship, Coalition, Islamic, Muslims, ”, .he, Christmas, Day, ”, ”, Muslim, Muslim, Christmas, Day, Muslim, December",49,62,32,17,0,102,37,45,34,28,0,0
132,PolitiFact_Fake_12,55,0,21.2,0,16,"Chicago, White, Castle, Michelle, Obama, LA, Obama, San, Fransisco, Air, Force, One",9,12,8,0,0,7,1,2,146,124,0,0
133,PolitiFact_Fake_13,287,58,14.4,0,11,"Detroit, MI, A, Michigan, Donald, Trump, US, Donald, Trump, Electoral, College, Trump, ’, Jeremy, Hashville, A, Detroit, City, Coroner, ’, Mr., Hashville, “, James, Arnold, Detroit, Police, Jeremy, Hashville, Grand, Old, Party, US, House",45,34,29,10,0,51,23,26,30,20,1,6
134,PolitiFact_Fake_14,90,56,9.1,0,8,"Donald, Trump, RIPTRUMP, TRUMPRIP, TRUMP4EVER, Donald, ’, PLEASE, SHARE, THIS, ARTICLE, TO, INFORM, EVERYONE, THE, SAD, LOSS, OF, DONALD, TRUMP",15,20,7,3,0,16,7,8,138,127,1,5
135,PolitiFact_Fake_15,186,20,8.2,0,7,"Monday, Bishop, Rome, Catholic, Pope, Francis, Vatican, ’, Koran, Holy, Bible, Jesus, Christ, Mohammed, Jehovah, Allah, God, God., FOR, ENTIRE, ARTICLE, CLICK, LINK",22,24,25,11,0,31,10,25,824,635,1,2
136,PolitiFact_Fake_16,370,36,7.5,0,16,"Vick, VapoRub, ’, Vick, VapoRub, Hours, ’, Mexican",66,9,37,18,0,69,32,54,60,58,1,8
137,PolitiFact_Fake_17,283,50,6.9,0,15,"ROCHESTER, New, Hampshire, –, Hollywood, Bill, Murray, Rochester, New, Hampshire, Rochester, New, Hampshire, Sure, ”, Rochester, –, Wild, Willy, ’, Great, ’, Rochester, Murray, Murray, L.A., Rochester, America., ”, David, Shankbone, /, CC, BY, /, Share",46,37,30,19,1,53,15,30,4,4,1,2
138,PolitiFact_Fake_18,218,0,11.5,0,15,"Michelle, Obama, ’, ’, Barack, Obama, ’, Congress, Obama, Grandma, Marian, Robinson, White, House, Freedom, Information, Act, FOIA, Mrs., Robinson, Malia, Sasha, President, Obama, ’, Michelle, Obama, ’, White, House",37,32,22,8,0,33,19,30,34,31,0,0
139,PolitiFact_Fake_19,163,46,9.5,0,9,"WASHINGTON, President-elect, United, Donald, Trump, Wednesday, President, Ghana, John, Dramani, Mahama, NY, Times, Trump, John, Mahama, Africa, ’, ’, President, President, Reverse, Trump, Trump, ‘, ’, Don, ’, Trump, ’, Ghana, National, Service, Scheme",20,35,23,4,0,33,13,17,6,6,1,6
140,PolitiFact_Fake_20,539,0,14.0,0,17,"President, Trump, Trump, President, Supreme, Court, Justice, Ruth, Bader, Ginsburg, November, Thursday, Donald, Trump, DON, T, WANT, TO, ABOUT, THAT, POSSIBILITY, BUT, IF, IT, SHOULD, BE, THEN, EVERYTHING, IS, UP, FOR, GRABS, ”, SHE, THE, ASSOCIATED, PRESS, IN, A, WIDE-RANGING, INTERVIEW, THAT, ALSO, TOUCHED, ON, THE, LOSS, OF, HER, DEAR, FRIEND, ANTONIN, SCALIA, AND, SOME, THE, COURT, ’, S, BIGGEST, RULINGS, IN, THE, TERM, THAT, ENDED, IN, LATE, JUNE, DISLIKE, THAT, MAN, A, NUMBER, OF, REASONS, AND, ALTHOUGH, SUPPOSED, TO, PUT, FORTH, MY, PERSONAL, VIEWS, BECAUSE, OF, MY, POSITION, FEEL, OBLIGATED, TO, DO, WHATEVER, CAN, IN, ORDER, TO, THE, PUBLIC, KNOW, THERE, ’, S, STILL, TIME, TO, MAKE, THE, RIGHT, CHOICE, ”, SHE, ADDED, DONALD, TRUMP, A, WHO, HAS, ACCUMULATED, HIS, VAST, WEALTH, NOT, BECAUSE, HIS, BUSINESS, PROWESS, BUT, BECAUSE, THE, FACT, THAT, MUCH, IT, WAS, INHERITED, FROM, HIS, FATHER, AND, GRANDFATHER, IN, FACT, WHEN, IT, COMES, TO, MAKING, IMPORTANT, DECISIONS, T, RECALL, HIM, EVER, MAKING, THE, RIGHT, ONE, AND, THAT, S, NOT, THE, TYPE, OF, MAN, THAT, SHOULD, BE, AT, THE, HEAD, THIS, COUNTRY., ”, AFTER, OPENING, FIRE, AT, THE, PRESUMPTIVE, REPUBLICAN, PRESIDENTIAL, CANDIDATE, GINSBERG, TURNED, TO, HER, OWNwi, PLANS, SHOULD, DONALD, TRUMP, ACTUALLY, BECOME, THE, NEW, PRESIDENT, THE, UNITED, THERE, ’, S, NO, NEED, TO, BEAT, THE, BUSH, SO, M, JUST, GOING, TO, GO, AHEAD, AND, SAY, IT, –, MY, POSITION, A, JUSTICE, THE, SUPREME, COURT, THE, UNITED, IF, THAT, HAPPENS, NOT, IMAGINE, PERFORMING, MY, DUTIES, UNDER, THE, CONSTANT, PRESSURE, WAKING, UP, IN, THE, MORNING, AND, HAVING, TO, GO, TO, WORK, KNOWING, THAT, EVERY, WE, AS, AN, INSTITUTION, MAKE, VIEWED, THE, PRISM, A, TRUMP, PRESIDENCY, THIS, CHARADE, A, PRESIDENTIAL, CAMPAIGN, BUT, COULD, NOT, LIVE, WITH, HIM, AS, PRESIDENT, ”, SHE, SAID, WOMAN, WHO, HAS, LIVED, LONG, ENOUGH, AND, TO, SAY, VE, PROSPEROUS, AND, FULFILLED, LIFE, ”, JUSTICE, GINSBERG, ARGUED, Constitution, United, GPS",31,305,24,13,0,66,16,40,173,158,0,0
141,PolitiFact_Fake_21,388,10,11.4,0,19,"Join, America, Line, Defense, Share, Article, SHARES, SHARE, ON, FACEBOOK, SHARE, ON, TWITTER, Donald, Trump, Hollywood, Meryl, Streep, Ron, Howard, Mrs., C, Streep, Otis, Winslow, “, Family, Matters, ”, Ron, Howard, Richie, Cunningham, Potsie, Malph, Henry, Winkler, Jon, Voight, Fonzie, ’, t, Charles, Charge, Chachi, Jeff, Scot, Baio, Florence, Henderson, Deborah, Everybody, Raymond, Meryl, Streep, ’, Trump, Trump, Donald, Trump, Just, New, Phrase, Meryl, Streep, ’, ’, ’, Fox",45,68,35,17,0,74,29,35,291,255,1,12
142,PolitiFact_Fake_22,639,40,8.9,0,16,"Republican, Supreme, Court, Indiana, Texas, Florida, Gov, Mike, Pence, Pence, Huffington, Post, “, “, So, ’, ’, Indiana, ”, Pence, ’, ’, ’, Indiana, ”, Pence, First, America, ”, Donald, Trump, ’, “, Basically, Indiana, ’, Pence",101,38,63,41,0,144,45,70,542,494,1,10
143,PolitiFact_Fake_23,416,0,7.5,0,10,"White, House, U.S., Barack, Obama, Obama, Administration, Dollar, ReDe, Project, U.S., Duncan, President, Obama, Dowling, Duncan, President, Obama, ”, David, Axelrod, Senior, Adviser, President, Obama, Dollar, Redesign, Project, Richard, Smith, Euro, Dollar, Redesign, Project, Don, ’, ”, Rahm, Emanuel, White, House, Chief, Staff, President, Dowling, Duncan, ’, Fed, Chairman, Benjamin, Bernanke, December, Emanuel, U.S., President, Obama, President, Lincoln, Thomas, Jefferson, Republican, Congressman, Paul, Ryan, President, Obama, “, ”, Uncle, Sam, ”, Axelrod, Uncle, Barack., ”, Administration, ’, ”, Minority, Leader, John, Boehner, ”, Speaker, House, Nancy, Pelosi, ’, American, Obama, December, FYI, Obama",67,93,48,17,0,93,31,64,17,15,0,0
144,PolitiFact_Fake_24,0,0,,0,5,,0,0,0,0,0,0,0,0,413,393,0,1
145,PolitiFact_Fake_25,253,0,11.1,0,10,"Rasheed, Muhammad, Tuesday, January, John, F., Kennedy, International, Airport, President, Trump, ’, United, Muhammad, Super, Bowl, LI, Former, Attorney, General, Sally, Yates, President, Trump, Snapchat, President, Donald, J., Trump, Attorney, General, FBI, Director, James, Comey, ”, Image, Executive, Order, Leads, Capture, ISIS, Leader, Rasheed, Muhammad, White, House, Press, Secretary",43,50,26,3,0,45,23,33,682,606,0,0
146,PolitiFact_Fake_26,352,35,7.8,0,12,"SHARES, Share, Tweet, United, NAY, OFFENSE, U.S., Harry, Truman, President, Trump, THE, BUCK, STOPS, HERE, D.C., ’, Capital, President, Trump, ‘, GLBT, WhiteHouse.Gov, PRESIDENT, TRUMP, DIRECTED, HIS, PEOPLE, TO, REMOVE, THE, SPANISH, SPEAKING, AND, TRANSLATING, PORTALS, ON, THE, WHITEHOUSE.GOV, WEBSITE, L.A., Times, President, Trump, White, House, Trump, Friday, Spanish…, Spokesman, Sean, Spicer, Monday, ”, Spicer, IT, Trump, Florida, Gov, Jeb, Bush, Trump, President, Trump, America, EVERYONE, IF, YOU, DON, ’, T, LIKE, IT-, LEAVE, Follow, President, Donald, J., Trump, Facebook",50,81,37,6,1,68,19,53,50,48,1,3
147,PolitiFact_Fake_27,523,0,14.6,0,12,"Breast, Feeding, Mugshot, EvenOriginal, Bradfordst, Via, Flickr, CC, BY, Heather, Watson, Baker, County, Idaho, Heather, ’, Rick, Watson, Caylee, Heather, Watson, Idaho, Idaho, Jury, Duty, Moveon.org, Idaho, Breastfeeding, Law, Coalition, ’, Idaho, Breastfeeding, Huffington, Post, Watson, National, Sex, Offender, Registry, Heather, ’, ’, Facebook, Heather, –, “, Idaho, “, Caylee, IDGAF, Heather, Watson, Facebook, PostScreenshot, Facebook, Though, Watson, ’, Jude, Walter, Chapman, Baker, County, Wiser, Idaho, ABC, Mrs., Watson, ’, ’, Judge, Watson, ’, Idaho, ’, Judge, Chapman, ’, Baker, County, Department, Justice, 785-273-0325",89,83,38,17,0,95,46,57,135,128,0,0
148,PolitiFact_Fake_28,256,0,11.6,0,15,"December, State, Senator, Doug, Ericksen, C, Washington, State, First, Amendment, Please, Constitutional, First, Amendment",41,14,28,13,0,47,20,36,50,48,0,0
149,PolitiFact_Fake_29,11,21,5.2,0,18,"Easy, Plugin, AdSense",0,3,0,1,0,2,0,1,136,126,1,15
150,PolitiFact_Fake_30,468,10,9.2,0,9,"CNBC, Trump, Trump, ’, Donald, Trump, ’, Dakota, Access, Pipeline, Sioux, Missouri, Mississippi, Rivers, November, National, Day, Action, Los, Angeles, Chicago, Denver, Trump, ’, Manhattan, Sioux, Nation, American, “, President, ”, Trump, Orange, Fuehrer, Trump, ‘, Trump, ’, Tenth, Amendment, Constitution, Trump, ’, Trump, Dakota, Pipeline, Trump, Trump, ’, Trump, Please",70,52,61,13,0,65,35,54,77,73,1,5
151,PolitiFact_Fake_31,193,0,14.1,0,10,"Westchester, County, New, York, Hillary, Rodham, Clinton, William, Jefferson, Clinton, Hillary, Rodham, Clinton, First, Lady, Secretary, State, President, United, Sec, Hillary, Rodham, Clinton, President, Bill, Clinton, Takeaway, Hillary, April, Fools",29,30,25,7,0,31,13,24,42,42,0,0
152,PolitiFact_Fake_32,257,0,7.2,0,5,"Senate, Armed, Chairman, John, McCain, Sunday, U.S., North, Korea, U.S., McCain, Meet, Press, Chuck, Todd, NBC, Foreign, Secretary, Sir, Malcolm, Rifkind, U.S., Suck, Watch, Full, Screen, Skip, Ads, Chuck, North, Korea, McCain, Trump, Republican, Democrat, Arizona, Republican, Kim, Jong, Un, Sunday, Trump, North, Korea, China, South, Florida, China, Trump, Trump, China",32,52,25,6,0,46,18,59,64,63,0,0
153,PolitiFact_Fake_33,655,55,8.7,0,15,"Wouldn, ’, Muslims, America, ”, Islamic, Hizb-ut-Tahrir, Australia, Islamic, Unthman, Badar, “, Requiring, ‘, Muslim, ’, [, God, ], Australia, ’, ’, Advance, Australia, Fair, Advance, Australia, Fair, Southern, Cross, Commonwealth, Advance, Australia, Fair, Advance, Australia, Fair, Super, ’, Hizb-ut-Tahrir, Unthman, Badar, Muslim, Muslims, ’, WQe, LEAVE, Muslim, Allah, ’, ’, ’, Obama, ’, Muslim, Christ, Allah, ’, Socialist",111,61,60,33,0,125,53,85,104,99,1,33
154,PolitiFact_Fake_34,442,56,7.6,0,12,"Bible, Lord, ’, Ten, Old, Testament, Lord, God, Lord, Exodus, “, ”, “, Thus, God, God, God, God, ’, Dr, John, Hagee, Cornerstone, Church, San, Antonio, Texas, Book, Newslo, Hagee, ”, “, Lord, ’, America, ”, Hagee, ’, Follow, God, ”, Asked, Hagee, Well, God, ’, Lord, ’, God, ’, Maker, ’, ”, /religionlo.com/, Comments",69,55,49,24,0,93,26,59,415,391,1,14
155,PolitiFact_Fake_35,364,0,14.2,0,10,"Government, MV, Nisshin, Maru, 日新丸, Japan, ’, ’, ”, Asuka, Kumara, Ocean, Whale, Sanctuary, South, Eastern, Coast, South, Africa, Antarctic, East, Antarctic, U.N., ’, International, Court, Justice, ICJ, Japan, Greenpeace, Canada, James, Ben, Shahali, Vancouver, Greenpeace, Greenpeace, Japan, International, Whaling, Commission, IWC",71,42,49,16,0,78,29,37,1438,1362,0,0
156,PolitiFact_Fake_36,416,0,7.5,0,7,"White, House, U.S., Barack, Obama, Obama, Administration, Dollar, ReDe, Project, U.S., Duncan, President, Obama, Dowling, Duncan, President, Obama, ”, David, Axelrod, Senior, Adviser, President, Obama, Dollar, Redesign, Project, Richard, Smith, Euro, Dollar, Redesign, Project, Don, ’, ”, Rahm, Emanuel, White, House, Chief, Staff, President, Dowling, Duncan, ’, Fed, Chairman, Benjamin, Bernanke, December, Emanuel, U.S., President, Obama, President, Lincoln, Thomas, Jefferson, Republican, Congressman, Paul, Ryan, President, Obama, “, ”, Uncle, Sam, ”, Axelrod, Uncle, Barack., ”, Administration, ’, ”, Minority, Leader, John, Boehner, ”, Speaker, House, Nancy, Pelosi, ’, American, Obama, December, FYI, Obama",67,93,48,17,0,93,31,64,396,349,0,0
157,PolitiFact_Fake_37,11,18,5.2,0,15,"Easy, Plugin, AdSense",0,3,0,1,0,2,0,1,91,86,1,16
158,PolitiFact_Fake_38,430,55,7.9,0,15,"Just, Gave, Every, LEGAL, Man, Woman, Child, USA, EACH, Easy, Plugin, AdSense, Please, OR, Suppress, Just, Gave, Every, LEGAL, Man, Woman, Child, USA, EACH, Tax, ”, White, House, Communication, Propaganda, Office, “, President, Trump, George, W, Bush, Clinton, Mr., trump, “, ’, Trump, Easy, Plugin, AdSense, Please, OR, Suppress, ’, Mexico, Whiskey, ”, North, Korea, Grab, Donald, Trump, Friday",81,59,45,20,0,67,29,46,93,85,1,14
159,PolitiFact_Fake_39,320,0,7.2,0,18,"Free, Wood, Post, HOUSTON, National, Rifle, Association, President, NRA, Jim, Porter, Civil, War, “, War, Northern, Aggression., ”, President, Obama, ”, Attorney, General, Eric, Holder, “, ”, NRA, NRA, ’, Porter, “, ’, War, Northern, Aggression, Several, NRA, Wayne, LaPierre, Porter, ’, LaPierre, “, Read",39,45,23,19,0,70,32,38,69,66,1,150
160,PolitiFact_Fake_40,517,56,10.1,0,13,"Donald, Trump, Politico, Breitbart, News, Stephen, Bannon, January, ’, California, ”, Bannon, Politico, ’, Donald, Trump, ’, Bannon, “, Well, Donald, Trump, Bannon, “, Alright, ’, ’, ’, ’, ”, Bannon, God, ”, “, Trump",80,35,40,38,0,125,34,73,162,152,1,14
161,PolitiFact_Fake_41,92,0,13.4,0,13,"A.R.H, Z|13, Security, White, House, President, Trump, ’, Android, –, DitchTheDevice, White, House, President, Trump, ’, Android, President, Trump, White, House",12,22,10,1,0,12,13,13,231,228,0,0
162,PolitiFact_Fake_42,280,0,6.7,0,7,"ABC, News, President, Jimmy, Carter, Nobel, Terrance, ‘, Scooby, ’, Williams, Dr., Green, ’, Greenery, Oakland, CA, Carter, Sawyer, “, Carter, Habitat, Humanity, Marijuana, God, ’, “, Carter, ’, Don, ’, Colorado, Washington, State, November, Presidential, Carter, California, Oregon, Massachusetts, Help",59,40,23,9,0,50,22,33,1030,911,0,0
163,PolitiFact_Fake_43,136,56,7.9,0,10,"James, G., Winters, Gainesville, FL, President, Barack, Obama, Winters, Joanna, Walker, Sunday, Toyato, Corrola, Orlando, Publix, Obama, James, Winters, *, *, UPDATE-, Anyone, *, *",25,25,14,3,0,21,11,22,144,137,1,105
164,PolitiFact_Fake_44,140,55,8.6,0,9,"Whoopi, Goldberg, Suing, Me, Whoopi, Goldberg, Wednesday, Navy, SEAL, President, Donald, Trump, ’, ”, Goldberg, ’, Goldberg, *, *, UPDATE-, Anyone, *, *, *",26,21,11,4,0,34,14,17,128,122,1,368
165,PolitiFact_Fake_45,203,0,10.8,0,15,"Trump, Obama, Trump, Tower, FBI, Obama, Toronto, International, Airport, Bruce, Wilekenmeyer., CRMP, US, Embassy, Washington, Obama, US, District, Court, Breitbart",32,20,23,8,0,44,16,19,70,51,0,0
166,PolitiFact_Fake_46,279,11,13.0,0,18,"Join, America, Line, Defense, Share, Article, SHARES, SHARE, ON, FACEBOOK, SHARE, ON, TWITTER, Former, Barack, Obama, FBI, Trump, Tower, Trump, Russia, President, Trump, Russia, Trump, FBI, Obama, ’, Todd, McMartin, FBI, Fox, News, Obama, Hillary, Clinton, ’, Trump, Tower, Obama, Huma, Abedin, FBI, President, Trump, Obama, ’, Russia, Obama, President",41,50,29,11,0,53,11,26,332,248,1,11
167,PolitiFact_Fake_47,0,0,,0,1,,0,0,0,0,0,0,0,0,166,158,1,25
168,PolitiFact_Fake_48,252,55,8.7,0,12,"Snoop, Dogg, “, Lavender, ”, Donald, Trump, President, Trump, ’, Breitbart, Snoop, Dogg, No, White, House, ’, Glen, Dingusman, Secret, Service, Snoop, Dogg, Trump, ’, America",50,26,29,7,0,41,18,26,167,149,1,2
169,PolitiFact_Fake_49,649,0,9.8,0,19,"Donald, Trump, Muslims, United, Europe, ISIS, Paris, Christian–they, Islam, Islam, United, Georgia, Muslim, State, Rep., Jason, Spencer, R, Wednesday, ’, Spencer, Islamic, Spencer, ’, Islamic, State, Georgia, Spencer, WSB-TV, Atlanta, First, Amendment, Islam, Christians, Allah, Allah, Bible, Allah, Day, Allah, Islam, Scripture, Jews, Jizya, Fight, Allah, Day, Allah, Islam, Scripture, Jews, Jizya, Allah, Liberals, Spencer, United, Georgia, Islam, France, Belgium, Italy, Spain, Switzerland",81,64,72,21,0,122,37,80,435,361,1,5
170,PolitiFact_Fake_50,371,16,7.8,0,14,"Join, America, Line, Defense, Share, Article, SHARES, SHARE, ON, FACEBOOK, SHARE, ON, TWITTER, Paul, Ryan, Speaker, House, White, House, Jeff, Derpinger, WHOIP, President, Trump, Speaker, Paul, Ryan, Congress, Donald, Trump, President, Trump, Ryan, ’, President, Trump, Breitbart, Speaker, Ryan, Donald, Trump, ’, Mr., Trump, Relate, President, Trump, Ryan, Trump, Speaker, Mr, Speaker…You, ’",49,57,40,19,0,67,22,44,36,34,1,14
171,PolitiFact_Fake_51,409,26,7.9,0,10,"Facebook, NBC, Just, Fired, Megyn, Kelly, New, Show, Begins, Megyn, Kelly, Oprah, Winfrey, NBC, Fox, Kelly, ’, Hugh, McGovern, Kelly, ’, Megyn, Fox, NBC, McGovern, Kelly, Maxwell, Seawald, CEO, NBC, Universal, Ms, Kelly, Fox, News, President, Trump, Diane, Sawyer, Kelly, Ripa., ”, Unfortunately, Kelly, ’, NBC, NBC, Hugh, Levitt, Fox, News, Megyn, Kelly, Trump, Fox, News, Sorry, Megyn, Hasta",67,59,32,16,0,81,16,48,427,385,1,2
172,PolitiFact_Fake_52,4155,36,5.6,0,12,"New, York, Man, Men, Women, HIV, New, York, HIV, Stephawn, Joshua, Johnson, Johnson, HIV, AIDS, Joshua, ’, HIV, U.S., Gay, Seekingarrangement.com, New, York, City, Isaac, Don, Burks, Stephawn, Burks, Stefan, Levine, Isaac, Levine, Stefan, Burks, Walter, Brooks, NYPD, HIV, Isaac, Don, Burks, HIV, Friday, Burks, Adam4Adam, Grindr, Jackd, BGCLive, West, New, York, NJ, Manhattan, HIV, Burks, Burks, “, ”, New, York, City, Health, Department, Kate, Caraway, HIV, HIV, Caraway, ”, Anyone, Burks, ’, Crime, Stoppers, 888-CRIMESC, Craig, Lamar, Davis, HIV, Full, Gospel, Baptist, Church, Joshua, Johnson, Isaac, Burks, Isaac, Don, Burks, Pictured, Above, Stephawn, Isaac, Burks, –, Isaac, Don, Burks, Atlanta, North, Carolina, Clark, Atlanta, University, Atlanta, Spelman, College, Clark, Ford, Explorer, Traxx, Atlanta, Saturday, Clubs, Charlotte, North, Carolina, Long, Island, Iced, Teas, Stephawn, E., Lindbergh, *, *, *, *, *, *, *, *, *, *, *, *, Atlanta, ’, *, *, *, *, *, *, k, *, *, *, *, *, *, *, *, *, *, *, *, *, *, *, *, *, ’, *, *, *, ’, *, *, *, Atlanta, ’, *, *, *, ’, “, ’, Christmas, HIV, ’, Today, ’, ’, Barry, Manilow, ’, Daybreak, *, *, *, ’, Brighter, HIV, ’, HIV, HIV, Stephawn, HIV, HIV, Isaac, Burks, Stephawn, HIV, ’, HIV, *, *, *, k, Isaac, Burks, Stephawn, HIV, HIV, Read, Isaac, Don, Burks, Response, Facebook, Page, Isaac, Don, Burks, Facebook, Page, HIV, Im, CAN, NOT, WIN, GOD, ’, SATAN, WWJD, GOD, BLESS",637,246,294,187,0,950,245,535,106,100,1,74
173,PolitiFact_Fake_53,160,14,7.8,0,10,"’, Federal, “, Black, Empowerment, ”, Eskom, Eskom, ’, ’, Eskom, ’, Eskom, South, Africa, ’, South, Africa, Channel, Reddit, Twitter, Google, Pinterest",22,24,13,6,0,34,19,25,1,1,1,4
174,PolitiFact_Fake_54,207,47,12.2,0,12,"Colorado, Rockies, Baseball, Team, Sell, Marijuana, Brownies, Their, Concession, Stands, DENVER, COLORADO, Colorado, Major, League, Baseball, ’, Colorado, Rockies, Pot, Brownies, Rockies, Durango, Bango, Rocky, Mountain, State",35,27,22,2,0,30,9,13,177,172,1,14
175,PolitiFact_Fake_55,52,0,8.9,0,13,"Backstage, Houston, Texas, New, Houston, Backstage.com, Dallas",15,7,0,2,0,8,1,14,4,4,0,0
176,PolitiFact_Fake_56,106,0,12.4,0,15,"Ken, Starr, Bill, Clinton, Washington, DC, Wilkershire, Maryland, NTSB, Philadelphia, Starr, Trey, Gowdy, ’, ’",20,15,12,4,0,20,7,9,35,32,0,0
177,PolitiFact_Fake_57,337,0,8.5,0,13,"Washington, Examiner, Clinton, Vince, Foster, Foster, ’, Rep., Trey, Gowdy, Vince, Foster, ’, Naval, Hospital, Norfolk, Virginia, Mr., Foster, LT, Col., James, McFitting, ’, Foster, Foster, ’, Mr., Foster, FBI, Foster, ’, Bill, Hillary, Clinton, Director, Comey, ’, Clinton",62,39,46,11,0,60,24,41,419,389,0,0
178,PolitiFact_Fake_58,271,30,8.0,0,10,"Cancer, Enzymes, Vaccines, All, Found, Murdered, Nagalese, D, Neon, Nettle, Florida, U.S, Nagalase, D, SCROLL, DOWN, FOR, VIDEO, Thebigriddle.com, Nagalase, Vitamin, D, Type, Diabetes, Dr, CAUSING, Dr, FL, Slow",37,29,27,12,0,73,13,44,3437,2548,1,26
179,PolitiFact_Fake_59,1064,56,7.5,0,15,"Rasheed, Thompson, Chicago, “, Black, Matter, ”, Chicago, Thompson, South, Pulaski, Road, West, Lexington, Street, Police, Block, West, Lexington, Street, ”, “, Black, ’, ”, Lt., Kyle, Jennings, Mr., Thompson, ”, Rasheed, Thompson, Chicago, “, Black, Matter, ”, Chicago, Thompson, South, Pulaski, Road, West, Lexington, Street, Police, Block, West, Lexington, Street, ”, “, Black, ’, ”, Lt., Kyle, Jennings, Mr., Thompson, ”, Lt., Jennings, Thompson, Thompson, ’, “, Black, Matter, ”, Black, Starbucks, ”, Officer, Douglas, Thompson, Police, Laquan, McDonald, Thompson, Thompson, PCP, Thompson, ’",163,87,124,32,1,219,54,121,462,416,1,19
180,PolitiFact_Fake_60,380,56,12.0,0,9,"United, President, Trump, Rep., Harold, Spunkmeyer, D-Illinois, Rep., Johnathon, Leominster, Jr, D-Massachusetts, President, Secret, Service, President, Trump, Florida, ’, ”, Agent, George, Ketterman, “, ’, Trump, ABC, Trump, ’, Washington, NBC, News, ’, Patriot, Act, Trump, ’, America",56,40,32,13,0,77,29,39,179,161,1,5
181,PolitiFact_Fake_61,280,27,7.0,0,13,"Donald, Trump, Donald, Trump, God, ’, Mary, Colbert, ’, Donald, Trump, God, ”, “, All, God, God, Evangelist, Kenneth, Copeland, Mary, Colbert, ’, God, President, Trump, Trinity, Broadcasting, Network, Trump, God, God, God, ”, Copeland, Colbert, ’, “, Pray, America, ”",29,41,22,11,0,72,13,34,127,122,1,6
182,PolitiFact_Fake_62,558,55,11.8,0,23,"Republican, Ohio, Gov, John, Kasich, “, Kasich, ’, “, ”, Kasich, Ohio, Daily, Star, ’, A, Kasich, ”, “, Ohio, ’",85,22,66,29,0,123,46,64,14,13,1,36
183,PolitiFact_Fake_63,293,50,7.2,0,16,"Facebook, Share, Facebook, ROCKFORD, Illinois, –, Hollywood, Vin, Diesel, Rockford, Illinois, Rockford, Illinois, Sure, ’, Rockford, –, State, Street, Great, ’, Rockford, ”, Diesel, Diesel, L.A., Rockford, Illinois, America., ”, Gage, Skidmore, /, CC, BY-SA, /, Share",46,38,32,20,1,54,14,35,1,1,1,3
184,PolitiFact_Fake_64,115,26,9.6,0,20,"Texas, Monday, Harris, County, Precinct, Assistant, Chief, Deputy, Clinton, Greenwood, Baytown, Lt., Steve, Dorris, Whether, ”, Dorris, Monday, Dorris, “",15,21,11,12,0,27,3,11,8,8,1,5
185,PolitiFact_Fake_65,578,57,9.9,0,13,"Tampa, ’, Darren, Winters, Darren, ’, ’, ”, Mr, Winters, Ybor, Clearly, ’, ”, Mr, Winter, ’, Mr, Winters, Mr, Winters, Winters, ], Winter, ’, Winter, ’, ‘, ‘, US, Tampa, Winters, ], Mr, Winters, Mr, Winter, ’, ’, Mr, Winters, Tampa, Decatur, Northern, Alabama",114,42,66,34,0,131,59,66,25,25,1,3
186,PolitiFact_Fake_66,229,56,9.0,0,9,"New, York, City, Chicago, United, Monday, ’, United, Pilot, Missouri, United",47,11,36,5,0,50,12,18,21,19,1,3
187,PolitiFact_Fake_67,223,56,13.0,0,5,"Malia, Obama, Harvard, University, ’, Malcolm, Little, ’, Malia, Boston, Harvard, Massachusetts, Malia, ’, Chancellor, Little, Malia, ’, ’, Clinton, Foundation, Obama, ’",59,23,31,3,0,44,15,23,364,322,1,4
188,PolitiFact_Fake_68,429,28,9.7,0,5,"COSTA, MESA, Ca, GOP, Donald, Trump, Thursday, America, ’, America, Sixties, ”, Trump, Pacific, Amphitheater, Costa, Mesa, Sixties, ”, Trump, Vietnam, Mr., Trump, Trump, ’, Islamic, State, Thursday, Pentagon, ”, Rather, United, Trump, “, President, Obama, United, ”, Donald, Trump, California, Thursday, Costa, Mesa, Orange, County, GOP, California, ’, Republican, Friday",62,52,37,19,1,103,41,45,111,68,1,56
189,PolitiFact_Fake_69,618,0,9.9,0,18,"President, Donald, Trump, Twitter, Easter, ’, Electoral, College., ”, China, North, Korea, Trump, Twitter, Electoral, College, Tax, Returns, Trump, Eric, KYXL, Radio, Orlando, Florida, President, Trump, ’, ’, Eric, “, United, ’, ”, Eric, President, Trump, U.S., ‘, ”, “, ’, ‘, ’, Bottom, ”, Eric",95,46,60,39,0,152,43,65,18,17,0,0
190,PolitiFact_Fake_70,19,4,3.5,0,4,"Error, Sorry",2,2,2,1,0,5,0,6,493,453,1,11
