NewsID,label,Text Length,Summary Length,Readability Score,Keyword Frequency,Title Length,Named Entities,num_nouns,num_propernouns,num_determinants,num_adverbs,num_interjections,num_verbs,num_adjectives,punctuation_count,TotalShares,UniqueUserShares,image_present,image_count
41,PolitiFact_Real_41,31,14,8.5,0,10,"ABC, News, Internet, Copyright, ABC, News, Internet, Ventures, ABC, News, Network",4,11,1,1,0,3,3,5,60,56,1,3
42,PolitiFact_Real_42,2109,20,9.3,0,3,"Panic, ’, ”, Story, Continued, Below, White, House, Barack, Obama, George, W., Bush, Obama, Bush, Donald, Trump, Hillary, Clinton, ’, James, Buchanan, ’, Franklin, Pierce, ’, Washington, Lincoln, Cal, Coolidge, Buchanan, Pennsylvania, America, ’, Buchanan, Panic, Europe, Bank, United, President, James, Knox, Polk, Oregon, California, Texas, West, Europe, Buchanan, Congress, Tariff, Bill, Dred, Scott, Supreme, Court, Buchanan, Roger, Taney, Supreme, Court, Buchanan, Dickinson, College, Scott, Missouri, Northwest, Scott, Buchanan, Union, Buchanan, Taney, Appeals, Court, Buchanan, Robert, Cooper, Grier, Dickinson, Pennsylvania, Taney, New, York, Justice, Samuel, Nelson, Legend, Taney, Capitol, Buchanan, Buchanan, Buchanan, Taney, Scott, Constitution, Fugitive, Slave, Law, Dred, Scott, Taney, Buchanan, West, Reading, Uncle, Pennybags, Monopoly, Reading, Railroad, Illinois, Central, Delaware, Lackawanna, Western, Fond, Lac, Railroad, Wisconsin, Senator, William, Seward, Republican, Party, Illinois, Central, Democrat, Stephen, Douglas, New, York, City, New, York, N.H., Wolfe, Co., August, Ohio, Life, Insurance, Trust, Co., Buchanan, Calm, Dred, Scott, West, Buchanan, Dred, Scott, Northern, South, Europe, North, South, Buchanan, Buchanan, ’, December, Panic, ’, ”, Buchanan, Kansas, Buchanan, John, Brown, Brown, Harpers, Ferry, West, Virginia, Washington, Potomac, Buchanan, Robert, E., Lee, Arlington, Texas, Lee, Harpers, Ferry, Brown, Buchanan, Utah, Mormon, William, Walker, ’, Nicaragua, Guatemala, Paraguay, Pig, War, San, Juan, Northwest, Hudson, Bay, Co., Buchanan, Kansas, U.S., Army, Buchanan, Democrat, Stephen, Douglas, ’, Republican, Abraham, Lincoln, Southern, Lincoln, ’, March, Buchanan, ’, Buchanan, Constitution, Buchanan, Cabinet, Southern, President, John, Tyler, Confederate, Buchanan, South, Fort, Sumter, Enter, Lincoln, Lincoln, James, Buchanan, “, Worst, President, Abe, Lincoln, George, W., Bush, Iraq, War, Crash, ’, Great, Recession, Obama, Honest, Abe, President, Hillary, Clinton, President, Donald, Trump, Robert, Strauss, Worst, President, James, Buchanan, POTUS, Rating, Game, Legacy, Least, Lesser",281,277,244,110,1,333,140,297,112,100,1,3
43,PolitiFact_Real_43,1170,9,10.6,0,6,"Nate, Smith, Texas, Nationalist, Movement, Smith, ’, Texas, Ritz, Hotel, Moscow, Sunday, Smith, Ritz, Moscow, ’, Kremlin-funded, Irish, Azerbaijani, King, Hawaii, Texan, United, Kremlin, Anti-Globalization, Movement, Russia, Kremlin, President, Vladimir, Putin, Texan, ’, Kremlin, Russia, ’, Aleksander, V., Ionov, Vladimir, Vladimirovich, Putin, ”, Ionov, President, Bashar, Russia, Ionov, ’, Moscow, ’, Moscow, Ukraine, Sunday, Kremlin, ’, ’, Smith, ABC, News, Smith, ’, Texas, Nationalist, Movement, Texas, United, Texas, GOP, Republican, Smith, Kremlin, ”, Smith, Texas., Louis, J., Marinelli, YES, California, Independence, Campaign, Golden, State, ”, Marinelli, Russia, U.S., IT, Marinelli, U.S., ”, Marinelli, Donald, Trump, U.S., America, U.K., Brexit, European, Union, Kremlin, Moscow, ”, Smith, Moscow, ’, Kremlin, Russia, West, France, ’, Union, Front, National, Soviet, Union, ’, ”, Peter, Kreko, Fulbright, Indiana, University, Russia, ’, Russia, ”, Kreko, Soviet, Union, ”, Kreko, Russia, Kremlin, ’, ”, Marinelli, ’, ’, ’, ”, Diarmuid, Mac, Dubhglais, Sinn, Féin, Northern, Ireland, Mac, Dubhglais, ’, “, Vladimir",187,160,124,60,0,229,116,182,33,25,1,5
44,PolitiFact_Real_44,1703,20,10.4,0,9,"President, Barack, Obama, Saudi, Arabia, Story, Continued, Below, Obama, Saudis, Islam, Arab, Middle, East, Iran, Saudis, Obama, Iran, Syria, ’, Obama, Congress, Saudi, Arabia, Obama, Riyadh, Congress, U.S.-Saudi, Washington, Jon, Alterman, Center, Strategic, International, Obama, Saudis, Yemen, U.S., Islamic, State, U.S., Saudis, Sen., Rand, Paul, Kentucky, Senate, Washington, Middle, East, U.S., Congress, Sept., Saudis, PR, Saudis, U.S., Saudis, U.S., Obama, Saudi, Arabia, U.S., Obama, Saudis, U.S., White, House, Josh, Earnest, Obama, Fifteen, Sept., Saudi, Islamist, Mindy, Kleinberg, Thursday, Obama, Saudi, Saudis, Obama, Riyadh, Obama, Hosni, Mubarak, Arab, Spring, America, Obama, President, Bashar, Assad, Saudis, Assad, Obama, Obama, Iran, Shiite, Sunni-majority, Saudi, Arabia, Middle, East, Obama, U.S., Middle, East, Saudi, India, Saudi, Salman, January, Saudis, Saudi, Iran, Atlantic, Saudis, Obama, U.S., Riyadh, Tehran, Saudis, —, Syria, Iraq, Yemen, —, ”, Obama, Prince, Turki, Al-Faisal, Saudi, Obama, America, ’, Gulf, U.S., April, Atlantic, Saudi, Arabia, Obama, Riyadh, Riyadh, Saudi, Saudi, Arabia, ’, Mohammed, Bin, Salman, Washington, ’, Washington, Obama, Saudi, Saudi, U.S., Saudis, Iran, United, Obama, U.S., America, ’, Saudi, Saudi, Arabia, —, Internet, Saudis, U.S., U.S., Saudi, Arabia, U.S., Saudis, Al, Qaeda, Saudi, U.S., Saudis, Islamic, State, ], Saudi, Saudi, Arabia, Fahad, Nazer, Saudi, Embassy, Washington, JTG, Inc, Obama, Saudis, Oval, Office, Saudis, Riyadh, Democrat, Hillary, Clinton, Republican, Donald, Trump, Saudi, Arabia, Islamic, Clinton, Clinton, Saudis, Trump, —, Muslims, United, —, Saudis, Congress, Congress, Obama, European, Union, Houses, Saudi, Arabia, Washington, U.S., Congress, Saudis",219,238,201,79,0,262,142,258,83,77,1,3
45,PolitiFact_Real_45,921,11,10.4,0,9,"Sen., Mitch, McConnell, Getty, McConnell, Senate, Majority, Leader, Mitch, McConnell, Monday, Zika, Tuesday, McConnell, —, Dec., Zika, Parenthood, ’, Puerto, Rico, Story, Continued, Below, “, Senate, ”, McConnell, R-Ky., Monday, ”, McConnell, Senate, Minority, Leader, Harry, Reid, D-Nev., Monday, Senate, Zika, Senate, Zika, Parenthood, —, Profamilias, ’, Puerto, Rico, CR, Puerto, Rico, Zika, ’, Zika, Monday, Reid, Close, Reid, Flint, Michigan, Capitol, Flint, Senate, Louisiana, Monday, Senate, Flint, Zika, Louisiana, Louisiana, Flint, ”, Sen., Chuck, Schumer, D-N.Y., Monday, Flint., Obama, ’, U.S., ’, Internet, Oct., Texas, Sen., Ted, Cruz, Cruz, —, Internet, ”, Florida, Sen., Bill, Nelson, Democrat, Monday, ”, Export-Import, Bank, ’, s, Senate, ’, November, Chris, Murphy, D-Conn., Rand, Paul, R-Ky., Senate, Saudi, Arabia, Obama, Senate, Majority, Whip, John, Cornyn, R-Texas, Cornyn, President, Barack, Obama, Sept., Saudi, Arabia, Obama, Friday, Senate, —, Sept., Heather, Caygle",168,139,106,38,0,150,61,130,15,14,1,3
46,PolitiFact_Real_46,416,19,9.4,0,13,"Alicia, Machado, Melania, Trump, Getty, Former, Miss, Universe, Melania, Trump, Alicia, Machado, Miss, Universe, Monday, Donald, Trump, ’, GOP, ’, Melania, Cosmopolitan, Tuesday, Machado, Melania, Trump, Machado, Melania, Trump, Story, Continued, “, ”, Machado, ”, Donald, Trump, Machado, Miss, Universe, Miss, Piggy, Miss, Housekeeping, Machado, Cosmopolitan, Machado, Miss, Venezuela, August, Cosmopolitan, Trump, Tuesday, Trump, Hillary, Clinton, Machado, ”, Miss, Universe, Miss, Universe, Miss, Universe, ”, Trump, Fox, News, ’, “, Fox, Friends., ”, “, Mother, Teresa, ’, ’, OK., Hillary",59,80,46,12,0,74,36,58,49,46,1,3
47,PolitiFact_Real_47,269,36,12.8,0,9,"Story, Ivanka, Trump, Washington, Rep., Cathy, McMorris, Rodgers, Trump, GOP, House, Congress, Washington, CNN, Ivanka, Trump, Republican, House, Tuesday, Washington, GOP, House, GOP, Washington, Rep., Cathy, McMorris, Rodgers, Republican, National, Committee, Donald, Trump, GOP, McMorris, Rodgers, Trump, Philadelphia, McMorris, Rodgers, House, Ivanka, Trump, Trump, Cosmopolitan, Magazine, Donald, Trump, Tuesday, Trump, House, Congress, GOP",39,53,22,6,0,33,21,29,6,5,1,2
48,PolitiFact_Real_48,269,32,12.8,0,6,"Story, Barney, Frank, Frank, Congress, Hillary, Clinton, Axe, Files, David, Axelrod, CNN, University, Chicago, Institute, Politics, David, Axelrod, Kiev, CNN, Washington, Barney, Frank, Occupy, Wall, Street, Frank, Massachusetts, David, Axelrod, Axe, Files, University, Chicago, Institute, Politics, CNN, Frank, Occupy, Wall, Street, Frank, Frank",33,43,20,10,0,59,16,50,111,97,1,4
49,PolitiFact_Real_49,809,0,10.6,0,10,"North, Carolina, HB2, LGBT, Friday, Gov, Pat, McCrory, State, House, Bill, July, NBA, February, All-Star, Game, Charlotte, Charlotte, NCAA, Atlantic, Coast, Conference, McCrory, May, U.S., Attorney, General, Loretta, Lynch, HB2, Civil, Rights, Act, Title, IX, Department, Justice, Lynch, Did, Legal, Most, Discriminate, Against, LGBT, People, IT, ALL, POLITICS, Did, Legal, Most, Discriminate, Against, LGBT, People, North, Carolina, Passes, Law, Blocking, Measures, LGBT, THE, TWO-WAY, North, Carolina, Passes, Law, Blocking, Measures, LGBT, —, Lynch, North, Carolina, American, Civil, Liberties, Union, March, Joaquin, Carcaño, University, North, Carolina, Chapel, Hill, North, Carolina, Sens, Tamara, Barringer, Rick, Gunn, Barringer, NPR, North, Carolina, North, North, Carolina, Arizona, State, University, Barringer, HB2, April, HB-2, North, Carolina, McCrory, Charlotte, LGBT, Charlotte, Observer, Charlotte, North, Carolina, Sues, DOJ, Over, LGBT, Law, DOJ, Sues, Back, THE, TWO-WAY, North, Carolina, Sues, DOJ, Over, LGBT, Law, DOJ, Sues, Back, Charlotte, City, Council, May, Jennifer, Roberts, Monday, HB2, Roberts, Monday, Charlotte, City, Charlotte",117,151,92,20,1,136,38,128,7,7,0,0
50,PolitiFact_Real_50,174,17,9.6,0,11,"Story, President, Barack, Obama, Obama, Donald, Trump, Clinton, CNN, President, Barack, Obama, Sunday, Hillary, Clinton, White, House, Obama, DNC, New, York, City, Obama, Clinton, Donald, Trump, Obama, Manhattan, Obama, Congressional, Black, Caucus, Washington, D.C., Trump",24,36,15,8,0,31,6,33,173,168,1,20
51,PolitiFact_Real_51,202,45,11.9,0,11,"Story, Michelle, Obama, Late, Show, Stephen, Colbert, Tuesday, CNN, Michelle, Obama, Tuesday, Melania, Trump, Republican, National, Convention, Late, Show, Stephen, Colbert, Melania, Trump, CBS, Obama, Colbert, Obama",23,27,23,3,1,43,15,31,130,111,1,2
52,PolitiFact_Real_52,51,0,8.7,0,13,"McCain, Criticized, Trump, Arpaio, ’, Pardon…, Sheriff, Joe, Fires, Perfect, Response, Joe, Arpaio, America, John, McCain, McCain, Donald, J., Trump, Arizona, Read",5,22,3,2,0,10,0,8,46,40,1,20
53,PolitiFact_Real_53,329,14,16.2,0,15,"Monday, Donald, Trump, Ahmad, Khan, Rahami, Saturday, New, York, City, Trump, Trump, *, Trump, Rahami, ’, NYPD, MSNBC, ’, Christopher, Hayes, Hayes, Trump, Fox, Friends, ”, Yup, –, Trump, NYPD, Republican, Trump, Trump, Trump, Spencer, Platt, /, Getty, Images",57,39,25,15,0,71,28,35,17,17,1,16
54,PolitiFact_Real_54,292,12,6.9,0,15,"Donald, Trump, Satanic, God, GOP, Dark, Lord, Wednesday, Trump, Midwest, Vision, Values, Pastors, Leadership, Cleveland, Darrell, Scott, Satan, Trump, Republican, Prince, Darkness, Scott, Trump, “, ”, Satanic, ’, ”, Scott, Scott, ’, Belinda, Scott, Trump, Satan, God, “, God, Donald, J., Trump, ”, “, America, Insert, Watch, Trump, Satan, Featured",53,51,23,16,1,64,24,57,6,6,1,9
55,PolitiFact_Real_55,1045,16,11.9,0,9,"AP, Photo, McConnell, Pelosi, Ryan, A, Flint, WRDA, Paul, Ryan, Senate, Majority, Leader, Mitch, McConnell, House, Minority, Leader, Nancy, Pelosi, Sept., Tuesday, Dec., Flint, Michigan, Water, Resources, Development, Act, Story, Continued, Below, Late, Tuesday, Pelosi, Ryan, Flint, Speaker, Ryan, Leader, Pelosi, WRDA, Flint, WRDA, Pelosi, Tuesday, House, Wednesday, Pelosi, CR, Flint, Ryan, GOP, Ryan, Pelosi, McConnell, Pelosi, Flint-WRDA, GOP, McConnell, Flint, WRDA, Senate, Minority, Leader, Harry, Reid, D-Nev., Flint, Senate, Louisiana, Senate, Tuesday, —, Dec., Louisiana, Flint, McConnell, Louisiana, GOP, Wednesday, Kentucky, Republican, Tuesday, Flint, McConnell, Informed, Reid, McConnell, Louisiana, Flint, Louisiana, ”, Senate, Minority, Whip, Richard, Durbin, Michigan, Flint, House, ”, Durbin, House, Minority, Whip, Steny, Hoyer, Hoyer, Zika, Capitol, Hill, July, Senate, Flint, Congress, Senate, Water, Resources, Development, Act, Flint, Louisiana, —, Flint, Flint, WRDA, GOP, Sen., Bill, Cassidy, Louisiana, Senate, Flint, House, Senate, Exchange, Commission, ’, Flint, McConnell, Reid, Senate, House, Jon, Tester, Montana, Joe, Manchin, West, Virginia, Joe, Donnelly, Indiana, Bill, Nelson, Florida, Zika, Ted, Cruz, Texas, Mike, Lee, Utah, South, Carolina, ’, Lindsey, Graham, Cruz, Obama, Internet, Graham, Export-Import, Bank, Heather, Caygle, Rachael, Bade, Annie, Snider",171,183,115,36,0,175,61,131,30,26,1,3
56,PolitiFact_Real_56,369,15,8.9,0,9,"Gary, Johnson, AP, Photo, Gary, Johnson, Green, Party, Jill, Stein, Sept., Sunday, Johnson, William, Weld, Steve, Kroft, Story, Continued, Below, Johnson, America, Weld, New, Mexico, Hillary, Clinton, Republican, Donald, Trump, Johnson, CBS, Weld, Trump, Clinton, Massachusetts, Johnson, Aleppo, Johnson, American, Aleppo, America, United",59,43,43,13,0,74,24,66,39,28,1,3
57,PolitiFact_Real_57,51,0,8.7,0,13,"McCain, Criticized, Trump, Arpaio, ’, Pardon…, Sheriff, Joe, Fires, Perfect, Response, Joe, Arpaio, America, John, McCain, McCain, Donald, J., Trump, Arizona, Read",5,22,3,2,0,10,0,8,31,28,1,20
58,PolitiFact_Real_58,1765,9,9.9,0,8,"Obama, Charlotte, America, Donald, Trump, Thursday, Charlotte, North, Carolina, President, Barack, Obama, ”, Pausing, Pittsburgh, Charlotte, Trump, America, ’, Story, Continued, Below, ”, Trump, America, Obama, ’, ’, ”, Trump, Charlotte, Trump, ’, Trump, Hillary, Clinton, Chicago, Obama, “, Charlotte, Trump, Thursday, “, Fox, Friends, “, ’, ”, “, Charlotte, —, —, Keith, Lamont, Scott, Tuesday, Wednesday, North, Carolina, Gov, Pat, McCrory, Charlotte, Thursday, Charlotte, Scott, Charlotte-Mecklenburg, Police, Chief, Kerr, Putney, Scott, Putney, Scott, Thursday, Scott, ’, Charles, Monnett, ’, Justin, Bamberg, ’, ’, Scott, Bamberg, “, Scott, Bamberg, Scott, ’, ”, Bamberg, ’, Yes, Obama, Thursday, Attorney, General, Loretta, Lynch, ”, ”, White, House, Josh, Earnest, ”, Wednesday, Scott, Tulsa, Oklahoma, Charlotte, ’, ”, Trump, ’, ’, Charlotte, ”, Trump, ’, ’, ”, Trump, ’, Dallas, Dallas, ”, Trump, ’, Trump, America, ’, ’, ”, Trump, United, America, ’, Trump, Former, House, Speaker, Newt, Gingrich, New, York, Mayor, Rudy, Giuliani, Fox, News, Obama, ’, First, ’, ”, Gingrich, Cambridge, Ferguson, Florida, ”, Giuliani, Obama, Wednesday, Friday, ’, Terence, Crutcher, New, York, Charlotte, “, ”, “, Wait, United, ”, Giuliani, United",279,183,162,83,1,410,157,257,22,22,1,2
59,PolitiFact_Real_59,229,29,9.7,0,11,"Story, Boy, Barack, Obama, Omran, Facebook, US, President, Alex, CNN, New, York, US, President, Barack, Obama, Omran, Daqneesh, Aleppo, Syria, Omran, Alex, Scarsdale, New, York, White, House, Alex, Obama, Omran, Obama, Alex, Omran, Alex, Omran, English, Catherine, Obama, Alex, United, Alex, Facebook",27,43,17,2,0,43,8,42,399,373,1,5
60,PolitiFact_Real_60,173,15,8.4,0,9,"Trump, Bill, Clinton, Donald, Trump, Bill, Clinton, ’, Bill, Clinton, ”, Trump, Chelsea, Clinton, ”, Story, Continued, Below, Trump, Melania",28,20,13,9,0,38,14,25,10,10,1,2
61,PolitiFact_Real_61,394,52,11.7,0,11,"Wednesday, Senate, President, Obama, Saudi, Arabia, Article, Section, Constitution, Journal, Senate, Senate, House, House, Justice, Against, Sponsors, Terrorism, Act, JASTA, Senate, Senate, House, Senate, House, Senate, Senate, President, Obama, ’, Friday, Wednesday, Congressional, Research, Service, Senate, President, United, Senate, JASTA, United, Saudi, Arabia, Middle, East, Senate, JASTA, House, House, Senate",56,51,67,14,0,62,19,58,98,86,1,4
62,PolitiFact_Real_62,357,4,8.2,0,12,"President, Obama, Trump, Donald, Trump, Trump, Trump, ’, Mahoning, County, Ohio, Kathy, Miller, “, Obama, Miller, Black, Matter, American, Miller, Trump, ’, Miller, Trump, ’, Ohio, Bob, Paduchik, Miller, ’, “, Trump",70,33,37,18,1,80,40,42,10,10,1,9
63,PolitiFact_Real_63,249,32,9.4,0,5,"Story, Famous, Arnold, Palmer, Sunday, Vice, President, Joe, Biden, Palmer, Monday, CNN, President, Barack, Obama, Vice, President, Joe, Biden, Arnold, Palmer, Obama, Sunday, Palmer, Oval, Office, King, Arnold, King, Arnold, —, President, Obama, @, POTUS, September, Obama, Palmer, Arnold, Palmer, Hospital, Children, Latrobe, Hospital, Vice, President, Scranton, Pennsylvania, Twitter, Monday, Arnie, Arnie, Vice, President, Biden, @, VP, September",25,58,27,5,0,39,11,52,28,24,1,3
64,PolitiFact_Real_64,453,37,14.0,0,11,"North, Koreans, Wonsan, North, Korea, AP, Photo, DOJ, U.S., North, Korea, A, Chinese, U.S., North, Korea, Monday, Department, Justice, Dandong, Hongxiang, Industrial, Development, Co., Ltd., International, Emergency, Economic, Powers, Act, Weapons, Mass, Destruction, Proliferators, Sanctions, Regulations, United, Story, Continued, U.S., Dandong, Hongxiang, Industrial, Development, Korea, Kwangson, Banking, Corporation, U.S., UN, Justice, Department, Dandong, Hongxiang, Industrial, Development, “, Justice, Department, Chinese, Dandong, Hongxiang, Industrial, Development, Justice, Department, United, U.S., President, Barack, Obama, ’, China, North, Korea, ’, ’, Obama, ’, Hillary, Clinton, China, North, Korea, Rep., Ed, Royce, R-Calif., Obama, North, Korea, Sanctions, Policy, Enhancement, Act, North, Korea, North, Korea, Donald, Trump, Clinton, North, Korea, ’, Jason, Miller, Trump, ’, Hillary, Clinton, Clinton, North, Korea, ’",62,114,33,8,0,69,32,66,24,23,1,3
65,PolitiFact_Real_65,554,25,7.0,0,8,"Monday, Hillary, Clinton, Donald, Trump, Nielsen, Nielsen, CNN, NBC, NBC, News, Lester, Holt, NBC, ABC, CBS, Fox, News, CNN, Fox, MSNBC, Univision, Telemundo, Clinton, Tuesday, Clinton, Jimmy, Carter, Ronald, Reagan, Obama-Romney, Nielsen, Contrary, Clinton, Tuesday, Trump-Clinton, Clinton-Trump, October, Monday, Twitter, YouTube, Twitter, Facebook, Trump, Clinton, Twitter, Trump, Clinton, Facebook, Trump, Clinton, Clinton, Trump, Trump, CNN, Clinton, Trump, Trump",85,60,56,26,0,77,45,94,249,225,1,14
66,PolitiFact_Real_66,318,11,9.3,0,8,"NATO, Secretary, General, Jens, Stoltenberg, |, Adem, Altan/AFP, Getty, NATO, Donald, Trump, ’, Jens, Stoltenberg, BRATISLAVA, —, NATO, Jens, Stoltenberg, Tuesday, Donald, Trump, U.S., ’, Atlantic, NATO, ’, U.S., ”, Stoltenberg, Bratislava, Trump, NATO, U.S., Monday, Hillary, Clinton, NATO, ”, Trump, NATO., ”, Stoltenberg, NATO, ’, Afghanistan, Afghanistan, ”, NATO, “, ISIL., ”, Stoltenberg, NATO, ’, “, U.S.",60,58,28,16,0,67,22,41,16,15,1,10
67,PolitiFact_Real_67,268,29,10.8,0,5,"Stop-and-frisk, New, York, City, Washington, CNN, Donald, Trump, Fox, News, Ricardo, New, York, Chicago, New, York, City, Stop-and-frisk, New, York, Mayor, Rudy, Giuliani, Trump, Latino",40,25,23,12,0,48,22,57,81,78,1,20
68,PolitiFact_Real_68,239,32,7.5,0,10,"Story, Trump, Boise, Idaho, CNN, Donald, Trump, Jr., Thursday, Skittles, Trump, Hillary, Clinton, Clinton, Trump, Trump, Trump, Skittles",44,19,26,7,0,53,8,56,211,191,1,18
69,PolitiFact_Real_69,437,22,11.8,0,8,"Jeffrey, DeLaurentis, America, Getty, Obama, Cuba, Cuba, Barack, Obama, Tuesday, Jeffrey, DeLaurentis, U.S., Cuba, America, Story, Continued, Cuban, Marco, Rubio, Florida, Ted, Cruz, Texas, Cuba, Obama, U.S., July, Obama, America, Cuba, U.S., U.S., Havana, Obama, Obama, Sen., Jeff, Flake, Arizona, Republican, Cuba, Jeff, DeLaurentis, US, Flake, Cuba, POLITICO, Cuba, Rubio, U.S., Cuban, Cuban, Cuba-U.S., Rubio, Rubio, Castro, Cuban",74,61,48,15,1,73,32,89,53,53,1,3
70,PolitiFact_Real_70,263,24,8.8,0,12,"Washington, CNN, Hillary, Clinton, Donald, Trump, Monday, Wednesday, Clinton, Trump, NBC/Wall, Street, Journal, Party, Gary, Johnson, Green, Party, Jill, Stein, Clinton, Trump, Clinton, Trump, Clinton, Trump, Clinton, Trump, Clinton, CNN, Poll, Polls, NBC/WSJ, Clinton, Trump, Poll, Polls, NBC/WSJ, September",53,39,22,5,0,34,20,66,340,290,1,19
71,PolitiFact_Real_71,458,4,14.0,0,15,"Wouldn, ’, ’, Arizona, Stephen, Anderson, Botswana, Anderson, ’, Botswana, United, Kingdom, ”, Botswana, Anderson, Steven, Anderson, South, Africa, ”, Home, Affairs, Minister, Malusi, Gigaba, BBC, ’, Constitution, Botswana, Anderson, Pastor, StevenAnderson, USA, Prohibited, Immigrant, Botswana, —, Botswana, Government, @, BWGovernment, September, ”, Anderson, Pulse, Bible, Bible, Bible, ”, Anderson, Bible, Bible, ”, “, Bible, God., ”, Anderson, France, ’, “, *, Orlando, “, “, *, ”, “, Christians, ”, God, President, Obama, God, Caitlyn, Jenner, ’, AIDS., ”, Anderson",80,79,41,20,1,103,25,53,27,27,1,9
72,PolitiFact_Real_72,496,9,12.7,0,15,"John, Prager, Oompa, Loompa, Donald, Trump, ”, —, Trump, ’, African-Americans, “, C, ”, Tuesday, Trump, African-Americans, —, ABC, News, Politics, @, ABCPolitics, September, Naturally, Internet, Jim, Crow, America, Slavery, Jim, Crow, Aaron, Sarka, @, SarkaAaron, September, @, @, ABCPolitics, @, Imagine, @, September, ABCPolitics, @, AA, BS, Bill, Grayson, @, September, ABCPolitics, @, MLWag, @, September, ABCPolitics, @, C, Nope, —, Jeffrey, Bloom, @, September, ABCPolitics, @, Minus, Jim, Crow, —, TPS, Report, @, ShoNuf77, September, ABCPolitics, @, Did, Salt, Pawn, Latte, @, x_PureSalt_x, September, ABCPolitics, @, Did, Slavery, Mirror, Donald, Trump, @, MirrorTrump, September, Fact, —, Matthew, Yglesias, @, September, AG, AG_Conservative, September, Trump, *, Featured",70,109,29,29,0,79,55,157,12,11,1,9
73,PolitiFact_Real_73,342,6,14.4,0,10,"SHARES, SHARE, THIS, STORY, NYC, Ahmad, Khan, Rahami, Houston, Texas, LA, Times, Matt, Pierce, Twitter, NYC, U.S., Attorney, Kenneth, Magidson, Houston, Cary, Lee, Ogborn, Friday, Houston, Texas, U.S., Attorney, “, Cary, Lee, Ogborn, Friday, ”, Ogborn, ’, Houston, Matt, Pearce, ’, ”, Islamic, Islamic, Gallup, Triangle, Center, Homeland, Security, Law, United, Muslims, United, ”, Add, Congress, President, ’, IMPEACH, DONALD, TRUMP",46,61,40,9,0,62,32,35,114,106,1,21
74,PolitiFact_Real_74,840,15,10.9,0,6,"Sen., Mitch, McConnell, Getty, McConnell, Mitch, McConnell, Capitol, McConnell, Thursday, —, ’, Story, Continued, Below, Gone, ICANN, Sen., Ted, Cruz, R-Texas, GOP, GOP, Donald, Trump, June, McConnell, Thursday, —, Dec., —, Zika, Tuesday, McConnell, ”, McConnell, ’, Washington, Louisiana, West, Virginia, Maryland, Flint, Michigan, Louisiana, Flint, New, York, Sen., Chuck, Schumer, Senate, Democrat, ’, Louisiana, Michigan, Exchange, Commission, Export-Import, Bank, ’, McConnell, Thursday, South, Carolina, Sen., Lindsey, Graham, Congress, ’, ”, White, House, Press, Secretary, Josh, Earnest, Thursday, Ex-Im, Bank, McConnell, Senate, Sen., Bill, Nelson, Florida, Zika, Zika, Flint, Florida, Nelson, Senate, Minority, Leader, Harry, Reid, D-Nev., McConnell, Thursday, OK, ”, Reid, [, House, Minority, Leader, Nancy, Pelosi, ], Thursday, Pelosi, ”, Maryland, Sen., Barbara, Mikulski, Democratic, McConnell, House, Speaker, Paul, Ryan, Cruz, House, Internet, Senate, Cruz, House, Obama, Internet, Heather, Caygle, Louis, Nelson, Burgess, Everett, Ashley, Gold",147,138,85,35,0,156,66,133,10,9,1,3
75,PolitiFact_Real_75,178,44,18.4,0,14,"Story, Ahmad, Khan, Raham, US, CNN, Ahmad, Khan, Rahami, Saturday, New, York, New, Jersey, Whether, Sen., Lindsey, Graham, R-South, Carolina, Rahami, Miranda, United, Supreme, Court, US, United",22,27,17,7,1,37,10,31,80,77,1,28
76,PolitiFact_Real_76,732,21,11.4,0,7,"Donald, Trump, Federal, Election, Commission, U.S., Secret, Service, Trump, Story, Continued, ’, —, Secret, Service, Clinton, Trump, TAG, Air, Inc., Clinton, Executive, Fliteways, Trump, Secret, Service, Brett, Kappel, Akerman, LLP, Trump, Trump-owned, Trump, Hope, Hicks, Secret, Service, “, FEC, USSS., ”, Secret, Service, Nicole, Mainor, FEC, “, Secret, Service, POLITICO, FEC, August, Trump, ’, Trump, Manhattan, TAG, Air, Inc., Trump, Thursday, Trump, Trump, ’, TAG, Air, FEC, Secret, Service, Craig, Engle, Arent, Fox, Federal, Election, Commission, Engle, Trump, U.S., U.S., Trump, Trump, Secret, Service, Trump, FEC, Trump, FEC, Trump, August, Trump, ’, Xmark, LLC, Black, Tie, Protection, KS, Global, Group",111,100,79,34,0,123,39,110,129,127,1,3
77,PolitiFact_Real_77,31,14,8.5,0,10,"ABC, News, Internet, Copyright, ABC, News, Internet, Ventures, ABC, News, Network",4,11,1,1,0,3,3,5,5,5,1,3
78,PolitiFact_Real_78,107,27,12.6,0,5,"Story, House, Speaker, Paul, Ryan, Donald, Trump, Ryan, New, York, Washington, CNN, Ivanka, Trump, Republican, House, Speaker, Paul, Ryan, New, York, Monday, Republican, CNN, Ivanka, Trump, Ryan, Ivanka, Ryan, Economic, Club, New, York",18,34,12,0,0,15,2,16,207,197,1,18
