NewsID,label,Text Length,Summary Length,Readability Score,Keyword Frequency,Title Length,Named Entities,num_nouns,num_propernouns,num_determinants,num_adverbs,num_interjections,num_verbs,num_adjectives,punctuation_count,TotalShares,UniqueUserShares,image_present,image_count
1,PolitiFact_Real_1,223,10,11.6,0,13,"SHARES, SHARE, THIS, STORY, Hillary, Clinton, Donald, Trump, Trump, Globe, Mail, March, Trump, Trump, ’, Great, Recession, Trump, ’, ”, Add, Congress, President, ’, IMPEACH, DONALD, TRUMP",46,27,16,9,0,34,18,24,36,35,1,16
2,PolitiFact_Real_2,515,6,11.2,0,12,"SHARES, SHARE, THIS, STORY, Republican, Donald, Trump, ’, Ohio, America, Kathy, Miller, America, ’, President, Obama, Obama, ’, ’, Obama, America, Obama, African-American, Black, Matter, Jim, Crow, Christian, Ku, Klux, Klan, War, Drugs, American, Trump, Kathy, Miller, Trump, Trump, Congress, President, ’, IMPEACH, DONALD, TRUMP",97,45,53,24,0,105,41,57,47,47,1,16
3,PolitiFact_Real_3,190,0,7.7,0,15,"University, North, Dakota, Facebook, Tuesday, Etonde, Maloke, “, ”, “, My, Maloke, ‘, ’, Racism, Twitter",38,16,22,8,0,49,12,19,32,32,0,0
4,PolitiFact_Real_4,160,6,9.9,0,12,"SHARES, SHARE, THIS, STORY, Massive, Charlotte, North, Carolina, Keith, Lamont, Scott, Scott, Charlotte, Terrence, Crutcher, Tulsa, Oklahoma, Scott",27,19,16,5,0,30,12,15,19,19,1,16
5,PolitiFact_Real_5,319,6,7.4,0,10,"Donald, Trump, Hillary, Clinton, Trump, ’, Was, Clinton, Howard, Dean, DNC, Dean, MSNBC, Notice, Trump, Coke, Howard, Dean, @, GovHowardDean, September, Trump, Twitter, Clinton, Dean, Trump, Trump, Republican, Dean, ’, Trump, Trump, Clinton, Hillary, Trump, Howard, Dean, Joe, Readle/Getty, Images",45,40,24,13,0,64,27,50,7,7,1,9
6,PolitiFact_Real_6,277,12,9.8,0,10,"SHARES, SHARE, THIS, STORY, New, York, Times, Donald, Trump, Quartz, New, York, Times, Sept., “, ”, “, “, ”, “, ’, Trump, Executive, Dean, Baquet, ”, Sept., ], Trump, ’, ”, Hopefully, Trump, ’, Republican, Trump, ’, Trump, ’, Hillary, Clinton, “, New, York, Times, Congress, President, ’, IMPEACH, DONALD, TRUMP",44,50,26,12,0,51,29,29,73,70,1,16
7,PolitiFact_Real_7,544,18,10.8,0,15,"First, Lady, Michelle, Obama, Civil, War, Institution, ’, National, Museum, History, Culture, Twitter, Mrs., Obama, Good, Morning, America, Robin, Roberts, White, House, First, Lady, Twitter, My, White, House, —, ABC, News, @, ABC, September, ABC, Mooch, Obummer, White, Trump, TrumpPence16, MakeAmericaGreatAgain, —, Chantie, Huffines, @, LadyChantie, September, ABC, Clintons, —, Deporable, @, September, ABC, Obamas, White, House, White, —, Mike, Van, Patten, @, MikeVanPatten4, September, @, ABC, So, Voter, @, Antone18, September, ABC, Keep, ABC, Ashton, Allen, @, Asherzz09, September, ABC, MOVE, OUT, BIMBO, —, Donna, Coffey, @, Dcoffey56Donna, September, @, ABC, Lord, Jesus, John, Stefanyszyn, @, JohnStefanyszyn, September, @, ABC, Republican, Party, Bev, Cross, @, BevCross1, September, ABC, NOT, GOTRUMP, —, Jane, @, September, Republican, Party, Civil, South, ’, Wikimedia",72,121,57,13,0,90,36,102,14,14,1,9
8,PolitiFact_Real_8,725,8,8.0,0,13,"SHARES, SHARE, THIS, STORY, Republican, Donald, Trump, Democratic, Hillary, Clinton, Clinton, Trump, Clinton, Mark, Cuban, Trump, Cuban, Trump, Cuban, Trump, Clinton, Trump, Clinton, ’, Trump, Trump, ’, Trump, Trump, “, No, ”, Trump, American, Cuban, Cuban, —, Dallas, Mavericks, Dallas, Dallas, Orlando, LGBT, Dallas, Dallas, Trump, —, Stefan, Becket, @, September, Cuban, Trump, Cuban, Trump, Did, Trump, Did, Trump, Trump, Trump, Trump, ’, Congress, President, ’, IMPEACH, DONALD, TRUMP",90,70,66,32,0,168,55,86,257,246,1,16
9,PolitiFact_Real_9,725,8,8.0,0,13,"SHARES, SHARE, THIS, STORY, Republican, Donald, Trump, Democratic, Hillary, Clinton, Clinton, Trump, Clinton, Mark, Cuban, Trump, Cuban, Trump, Cuban, Trump, Clinton, Trump, Clinton, ’, Trump, Trump, ’, Trump, Trump, “, No, ”, Trump, American, Cuban, Cuban, —, Dallas, Mavericks, Dallas, Dallas, Orlando, LGBT, Dallas, Dallas, Trump, —, Stefan, Becket, @, September, Cuban, Trump, Cuban, Trump, Did, Trump, Did, Trump, Trump, Trump, Trump, ’, Congress, President, ’, IMPEACH, DONALD, TRUMP",90,70,66,32,0,168,55,86,257,246,1,16
10,PolitiFact_Real_10,420,30,9.3,0,16,"VIDEO, ], Animal, Don, ’, News, Loung, Cambodia, Thailand, Sukhumvit, Road, Thailand, Route, Bangkok, Cambodia, Loung, ’, Young, Adults, Should, Know, Sir, John, Hawkins, John, Hawkins, Things, All, Young, Adults, Should, Know, Hawkins, Buy, Ban, Nong, Khon, Chanthaburi, Loung, Loung, ’, Loung, ’, Thailand",68,46,39,19,0,78,29,41,26,26,1,22
11,PolitiFact_Real_11,287,10,8.3,0,11,"Clinton, Hillary, Clinton, Donald, Trump, Monday, Donald, Trump, —, Bill, Clinton, Hillary, ”, Trump, ”, Story, Continued, Below, Trump, Clinton, Trump, “, Monday, ’, ”, Clinton, Trump, Clinton, ”, Trump, Rosie, O, ’, Donnell, ”, Clinton, “, Lester, Trump, Bill, Clinton, ”, Trump, Chelsea, Clinton, ”",31,46,16,19,0,72,28,55,37,32,1,2
12,PolitiFact_Real_12,380,25,8.3,0,12,"Donald, Trump, Hillary, Clinton, Getty, Trump, Clinton, Sleep, Hillary, —, Hillary, Clinton, Donald, Trump, Tuesday, North, Carolina, Trump, Story, Continued, Below, “, Do, Hillary, Trump, Tuesday, Hillary, Clinton, Sleep, Hillary, —, Trump, ’, Clinton, Steve, Harvey, ”, Clinton, Trump, Monday, New, York, Harvey, Steve, ”, ”, Trump, Clinton, Tuesday, Islamic, State, State, Department, Crooked, Hillary, ISIS, ”, Clinton, Tuesday, Chappaqua, New, York, Trump, Monday, —, White, New, York, Philadelphia, New, York, City, Florida, Wednesday, Gabriel, Debenedetti",57,76,32,14,0,78,18,49,46,44,1,3
13,PolitiFact_Real_13,271,15,5.6,0,15,"Donald, Trump, “, America, America, Republican, United, America, Trump, ’, Hillary, Buyer, ’, Guide, Donald, Trump., ”, Donald, Trump, ’, ”, Hillary, Trump, America, HillaryClinton.com, Trump, China, Hillary, ’, Trump, ’, Trump, America, Hillary, Trump, Sara, D., Davis/Getty, Images",38,41,21,24,0,49,23,40,68,66,1,11
14,PolitiFact_Real_14,369,29,8.4,0,8,"Reps., John, Lewis, D-Ga., Brenda, Lawrence, D-Mich., Maxine, Waters, D-Calif., Cedric, Richmond, D-La, Congressional, Black, Caucus, Department, Justice, Thursday, Getty, Black, Caucus, DOJ, Congressional, Black, Caucus, Department, Justice, Rep., Maxine, Waters, D-Calif., Story, Continued, Lynch, Office, Civil, Rights, ”, CBC, ’, Congress, [, House, Speaker, ], Paul, Ryan, ”, Rep., Gregory, Meeks, D-N.Y., Rep., Cedric, Richmond, D-La, Ryan, R-Wis., ”, Charlotte, Rep., Alma, Adams, D, North, Carolina, ”, Capitol, DOJ, Capitol, DOJ",47,72,35,18,0,65,18,84,33,32,1,3
15,PolitiFact_Real_15,533,10,9.0,0,12,"SHARES, SHARE, THIS, STORY, Donald, Trump, Republican, Party, ’, Chelsea, New, York, City, Trump, ”, Trump, September, FOX, News, Think, Hillary, Clinton, ’, ”, Mr., Trump, Sikh, Harinder, Bains, Ahmad, Rahami, Bains, CNN, American, Christian, Sikh, Muslim, ’, Sikh, ”, Bains, CNN, ’, Chris, Cuomo, Muslims, Syria, Civil, War, United, Mr., Bains, ’, Orlando, FBI, Mateen, ’, Trump, Mr., Trump, ’, America, –, Congress, President, ’, IMPEACH, DONALD, TRUMP",78,69,48,16,0,100,41,60,171,166,1,16
16,PolitiFact_Real_16,325,13,10.5,0,8,"Hillary, Clinton, Donald, Trump, Getty, Clinton, Trump, Donald, Trump, President, Barack, Obama, Monday, Hillary, Clinton, Trump, Obama, Hawaii, Story, Continued, Trump, Lester, Holt, Trump, Trump, Republican, Clinton, Obama, Kenya, Clinton, Obama, Clinton, Trump, Clinton, Barack, Obama, Trump",46,37,26,13,0,64,25,59,29,24,1,3
17,PolitiFact_Real_17,1157,19,7.8,0,8,"District, Columbia, AP, Photo, Voting, Friday, Election, Day, Monday, Wisconsin, Rapids, Wisconsin, Friday, South, Dakota, Minnesota, New, Jersey, Saturday, Vermont, Saturday, Story, Continued, Below, District, Columbia, Michael, McDonald, University, Florida, GOP, McDonald, ’, Alabama, —, ’, Alabama, Alaska, —, Oct., Arizona, —, Oct., Arkansas, —, Oct., California, —, Early, Oct., Los, Angeles, County, Colorado, —, Oct., Connecticut, —, Connecticut, District, Columbia, —, Oct., Judiciary, Square, Oct., Delaware, —, Delaware, Florida, —, All, Oct., Nov., Georgia, —, Oct., Sept., Hawaii, —, Oct., Idaho, —, Sept., Illinois, —, Sept., Nov., Sept., Oct., Indiana, —, Oct., Iowa, —, Sept., Kansas, —, Oct., Kentucky, Kentucky, Louisiana, —, Oct., Nov., Maine, —, Oct., Maryland, —, Oct., Nov., Massachusetts, —, Oct., Nov., Michigan, —, Michigan, Minnesota, —, Sept., Mississippi, —, Mississippi, Missouri, —, Missouri, Montana, —, In-person, Oct., Nebraska, —, Oct., Oct., Nevada, —, Oct., New, Hampshire, —, New, Hampshire, New, Jersey, —, Sept., In-person, New, Mexico, —, Oct., Nov., Oct., New, York, New, York, North, Carolina, —, Sept., Oct., Nov., Absentee, October, North, Dakota, —, Sept., Ohio, —, Oct., Oklahoma, —, Nov., Nov., Oregon, —, Oct., Pennsylvania, —, Pennsylvania, Rhode, Island, —, Rhode, Island, South, Carolina, —, South, Carolina, South, Dakota, —, Sept., Tennessee, —, Oct., Nov., Texas, —, Oct., Nov., Utah, —, Oct., Nov., Virginia, —, Virginia, Vermont, —, Sept., Nov., Washington, —, Oct., West, Virginia, —, Oct., Nov., Wisconsin, —, Early, Wisconsin, Rapids, Sept., Sept., Nov.",138,226,90,35,0,171,89,232,203,179,1,3
18,PolitiFact_Real_18,256,7,9.2,0,10,"Rep., Peter, King, New, York, Rep., Peter, King, Secretary, State, Hillary, Clinton, ’, Muslims, Muslim, ”, King, MSNBC, Clinton, ’, Manhattan, Story, Continued, Below, King, Islam, Sen., Joseph, McCarthy, ’, King, Clinton, ISIL, ’, King, Muslim, King, Irish",45,38,26,9,0,51,19,45,41,33,1,2
19,PolitiFact_Real_19,819,13,10.5,0,6,"Ahmad, Khan, Rahami, FBI, AP, Photo, Manhattan, NEW, YORK, —, Police, Monday, Manhattan, New, Jersey, New, York, Ahmad, Khan, Rahami, U.S., Afghanistan, Elizabeth, New, Jersey, New, York, City, Mayor, Bill, de, Blasio, Story, Continued, Below, Manhattan, Chelsea, Saturday, New, Jersey, Chelsea, Sunday, Elizabeth, New, Jersey, State, Police, Monday, FBI, Chelsea, New, Jersey, Seaside, Park, Jersey, New, York, Gov, Andrew, Cuomo, Blasio, CNN, Monday, FBI, Elizabeth, Rahami, Elizabeth, Saturday, Chelsea, Blasio, Cuomo, Monday, Blasio, NY1, News, Cuomo, MSNBC, White, House, President, Barack, Obama, Monday, New, York, City, New, Jersey, Spokesman, Josh, Earnest, Obama, Monday, Sunday, FBI, Brooklyn, Manhattan, FBI, Kelly, Langmesser, Associated, Press, FBI, Manhattan, Langmesser, Cuomo, Saturday, Chelsea, Chelsea, Sunday, Chelsea, Tannerite, Tannerite, New, York, City, Jersey, Tannerite, New, Jersey, AP, Saturday, Seaside, Park, New, Jersey, New, York, City, New, Jersey, Minnesota, St, Cloud, Allah, Muslim, Islamic, State",139,138,102,18,0,148,37,115,46,44,1,3
20,PolitiFact_Real_20,308,21,10.7,0,11,"Gov, Chris, Christie, Camden, N.J., |, AP, Photo/Mel, Evans, Christie, Gov, Chris, Christie, Tuesday, Morning, Consult, New, Jersey, Christie, Story, Continued, Below, Republican, Sam, Brownback, Kansas, Democrat, Dan, Malloy, Connecticut, Morning, Consult, Christie, Rutgers-Eagleton, Monday, Bridgegate, Monday, Christie, George, Washington, Bridge, Christie, Morning, Consult, Republican, Governors, Association, Massachusetts, Gov, Charlie, Baker, Maryland, Gov, Larry, Hogan, Republican, South, Dakota, Gov, Dennis, Daugaard, New, Jersey",59,63,35,10,0,32,10,36,11,11,1,3
21,PolitiFact_Real_21,449,13,8.5,0,11,"Hillary, Clinton, Donald, Trump, Republican, Trump, Hofstra, University, IRS, Hempstead, New, York, ’, Clinton, Trump, White, House, Clinton, Trump, ”, ’, Trump, Clinton, Donald, ”, Trump, Clinton, Secretary, Clinton, ”, Clinton, Trump, ’, Trump, ABC, News, Nicole, Phillip, Maggie, McNish, Sunny, Choo",75,43,39,26,0,101,36,64,56,53,1,4
22,PolitiFact_Real_22,161,4,6.3,0,12,"Tonight, ’, Hofstra, University, Hempstead, New, York, Guess, CBS, News, Sign, Student, Center, Hofstra, —, Tony, Aiello, @, AielloTV, September, Yep, Donald, Trump, ’, Right, Scoop",28,29,15,6,0,32,14,30,1,1,1,9
23,PolitiFact_Real_23,379,8,10.3,0,10,"North, Carolina, TargetSmart, NBC, News, Mitt, Romney, North, Carolina, President, Obama, Kerry, Bush, Nate, Silver, ’, FiveThirtyEight, Clinton, North, Carolina, Clinton, ’, New, York, Times, ’, Clinton, North, Carolina, Again, Governor, Pat, McCory, GOP, November, ’, November, President, Obama, Romney, September, Obama, November, Rachel, Maddow, Justin, Sullivan/Getty, Images",65,48,31,16,0,57,23,59,19,18,1,9
24,PolitiFact_Real_24,316,0,6.8,0,9,"Ukraine, Arina, Koltsova, New, Year, ’, Day, Daily, Mail, Koltsova, Video, Keith, Urban, New, Year, Day, Her, Officer, Mikhail, Kindrakevich, Daily, Mail, IV, ”, Koltsova, July, Kiev, Kiev, Arina, ”, Koltsova, ’, Video, Keith, Urban, Arina, National, Health, Koltsova, Koltsova, ’",55,41,26,12,0,68,26,40,13,12,1,13
25,PolitiFact_Real_25,358,30,8.6,0,14,"Construction, “, Great, Wall, ”, –, Meant, Illegal, OUT, VIDEO, United, Kingdom, Calais, France, English, Channel, Jungle, United, Kingdom, Young, Adults, Should, Know, Sir, John, Hawkins, John, Hawkins, Things, All, Young, Adults, Should, Know, Hawkins, Buy, Jungle, Calais, Calais, Jean-Marc, Puissesseau, Liberals, United, Kingdom, Donald, Trump",53,48,35,13,0,76,17,41,13,13,1,22
26,PolitiFact_Real_26,1481,31,7.9,0,7,"KALLSTADT, Germany, —, Few, Germany, ’, Kallstadt, U.S., Republican, Donald, Trump, ’, Frankfurt, Kallstadt, Saumagenkerwe, Germany, Trump, Pew, Research, Center, Johannes, Steiniger, Trump, Hillary, Clinton, Trump, Steiniger, POLITICO, Trump, ’, Kallstadt, ”, Sarah, Bühler, Saumagenkerwe, ’, Bühler, “, ’, ”, Bühler, Pink, ’, ”, Tanja, Huber, Trump, Kallstadt, ’, t, Trump, ”, Huber, ”, *, *, *, Donald, ’, Friedrich, Trump, Kallstadt, March, Trump, Trump, ”, “, Dromb, ”, “, Trumpff, ”, Drumpf, ”, Gwenda, Blair, Friedrich, “, Trump., ”, Germany, Kallstadt, Palatinate, Kingdom, Friedrich, ’, Friedrich, Katharina, United, New, York, Eider, October, U.S., Bavaria, ”, Roland, Paul, Institute, Palatinate, Regional, History, Folklife, Kaiserslautern, Paul, Friedrich, U.S, Friedrich, Palatinate, Blair, Kallstadt, Elisabeth, Christ, Friedrich, August, New, York, Friedrich, U.S., America, Donald, Trump, ’, American-born, John, Walter, Simone, Wendel, Friedrich, Kallstadt, United, U.S., Blair, ’, Kallstadt, Friedrich, February, Kallstadt, Friedrich, May, ”, Friedrich, —, Pennsylvania, July, New, York, Donald, ’, Fred, Trump, Junior, ], ‘, ”, Walter, America, ’, Donald, ”, Friedrich, —, Frederick, —, May, Kallstadt, *, *, February, Simone, Wendel, Kallstadt, Donald, Trump, Kings, Kallstadt, Donald, Trump, Henry, John, Heinz, Heinz, Ketchup, Wendel, Trump, Walter, Trump, ’, Kallstadt, Wendel, Walter, Trump, Tower, ’, Linzer, Walter, Trump, Trump, ’, Hello, John, ”, Trump, ’, Wendel, Trump, Boeing, New, York, ’, Central, Park, Wendel, Afterwards, Trump, Wendel, Trump, U.S., World, Wars, Wendel, Kallstadt, ”, “, Wow, ”, Trump, Walter, Wendel, Trump, Tower, Trump, ’, Eric, Trump, Kallstadt, ”, Wendel, Kallstadt, ”, Trump, Junior, “, No",256,244,130,57,0,272,117,246,93,90,1,15
27,PolitiFact_Real_27,51,0,8.7,0,13,"McCain, Criticized, Trump, Arpaio, ’, Pardon…, Sheriff, Joe, Fires, Perfect, Response, Joe, Arpaio, America, John, McCain, McCain, Donald, J., Trump, Arizona, Read",5,22,3,2,0,10,0,8,5,5,1,20
28,PolitiFact_Real_28,355,13,11.9,0,9,"Rex, Elsass, Donald, Trump, Getty, Trump, GOP, Elsass, Donald, Trump, ’, Hillary, Clinton, ’, GOP, Rex, Elsass, Trump, New, York, City, Story, Continued, Below, Elsass, Trump, Mike, Pence, Trump, Kellyanne, Conway, Missouri, Senate, Todd, Akin, Elsass, Strategy, Group, Media, Jim, Murphy, Trump, ’, Trump, ’, Jamestown, Jamestown, Jason, Miller, Larry, Weitzner, Trump, Rick, Reed, GOP, Swift, Boat, Veterans, Truth, John, Kerry, Elsass, Trump, Sept., Smart, Media, Group, Republican, National, Committee, Trump, Clinton, Republican, Trump, ’, GOP, Elsass, Rand, Paul, Paul, ’, John, Kasich, Michele, Bachmann, Newt, Gingrich, Elsass, Trump",55,89,29,3,0,58,31,46,28,27,1,3
29,PolitiFact_Real_29,369,11,12.8,0,9,"Police, Omni, Hotel, Keith, Scott, September, Getty, McCrory, Charlotte, North, Carolina, Gov, Pat, McCrory, Charlotte, Wednesday, State, Emergency, Nat, Guard, Highway, Patrol, CLT, McCrory, Wednesday, Story, Continued, Below, Civil, Tuesday, Keith, Lamont, Scott, Wednesday, Wednesday, Associated, Press, Charlotte, Charlotte, North, Carolina, McCrory, Wednesday, CNN, McCrory, North, Carolina, Scott, Charlotte-Mecklenburg, Police, Department, Scott",67,52,48,18,0,65,20,47,37,35,1,3
30,PolitiFact_Real_30,493,10,10.4,0,11,"Donald, Trump, Cleveland, Wednesday, Fox, News, Thursday, Trump, New, York, New, York, City, New, York, City, Police, Commissioner, Bill, Bratton, Mayor, Rudy, Giuliani, Trump, Trump, Giuliani, New, York, Tuesday, Trump, Thursday, Fox, Friends, Chicago, Chicago, Trump, Chicago, Trump, Trump, Congressional, Black, Caucus, Trump, New, York, Donald, Rep., Hakeem, Jeffries, D-New, York, Donald, Trump, Rep., Yvette, Clarke, D-New, York",81,59,36,30,0,91,30,85,55,49,1,4
31,PolitiFact_Real_31,263,11,11.8,0,8,"United, Nations, Arab, Red, Crescent, Talbisseh, Homs, September, Mahmoud, Taha/AFP, Getty, Images, UN, Syria, Trucks, United, Syria, Aleppo, BBC, Thursday, U.N., ’, Office, Coordination, Humanitarian, Affairs, Aleppo, U.S., Monday, ’, U.N., Russia, U.S., U.S, Predator, September, Washington, Syria, BBC, U.N., U.S., Secretary, State, John, Kerry, Syria, ’, ”",40,49,31,6,0,47,18,45,69,65,1,11
32,PolitiFact_Real_32,496,30,5.8,0,16,"KISS, ’, Gene, Simmons, War, Terror, Profile, Everyone, Profile, ME, VIDEO, War, Terror, George, W., Bush, ’, Barack, Obama, Obama, Muslim, Syria, Obama, United, Muslim, Obama, KISS, Gene, Simmons, War, Terror, Things, All, Young, Adults, Should, Know, Sir, John, Hawkins, John, Hawkins, Things, All, Young, Adults, Should, Know, Hawkins, Buy, Simmons, ‘, ’, ’, “, ’, Israel, ’, Muslims, Muslim, ISIS, ’, Second, Amendment, Get",68,68,28,32,1,111,44,85,12,12,1,22
33,PolitiFact_Real_33,574,24,10.7,0,9,"John, Kerry, Washington, AP, Photo, Kerry, NEW, YORK, United, Russia, Thursday, Syria, Aleppo, Secretary, State, John, Kerry, Russia, Middle, Eastern, Story, Continued, Below, Kerry, U.N., General, Assembly, Kerry, Russian, Foreign, Minister, Sergey, Lavrov, Syria, Kerry, Lavrov, Friday, New, York, Syria, Aleppo, Kerry, BlackBerry, Kerry, Lavrov, Lavrov, Kerry, President, Bashar, Assad, Kerry, U.S., Russia, Kerry, Syria, Russia, Assad, AP, Damascus, United, U.S., U.S., Lavrov, U.S.",80,67,70,20,0,105,42,98,16,14,1,3
34,PolitiFact_Real_34,336,24,7.8,0,16,"SHARES, Facebook, Twitter, Reddit, Stumbleupon, Pinterest, Fox, News, Donald, Trump, Ford, Motor, Company, United, Mexico., ”, Trump, President, Ford, United, Donald, Trump, Ford, CEO, Mark, Fields, CNN, ”, CNN, Poppy, Harlow, Ford, Mexico, Zero, US, ’, ”, Continue, Ford, United, Mexico, Donald, Trump, Michigan, Ohio, Pennsylvania, Wisconsin–where, Trump, Election, Day, Trump, Tax, Image, Via, Business, Trajectory, SHARES, Facebook, Twitter, Reddit, Stumbleupon, Pinterest",36,63,34,16,1,56,19,41,171,169,1,4
35,PolitiFact_Real_35,330,21,10.1,0,11,"Toby, Keith, South, Carolina, Toby, Keith, Florence, Civic, Center, South, Carolina, September, Toby, Keith, Toby, Keith, ’, South, Carolina, Southeast, General, Manager, Florence, Civic, Center, Kendall, Wall, Keith, ’, Florence, Civic, Toby, ’, ”, March, Toby, Keith, South, Carolina",45,40,39,5,0,69,28,22,5,5,1,49
36,PolitiFact_Real_36,1523,31,12.7,0,9,"New, York, CNN, Hillary, Clinton, Donald, Trump, United, Nations, General, Assembly, Monday, Clinton, Trump, Egyptian, President, Abdel, Fattah, Monday, Clinton, President, Barack, Obama, Prime, Minister, Shinzo, Abe, Ukrainian, President, Petro, Poroshenko, Trump, Monday, New, York, Trump, Monday, Fox, News, Clinton, US, Clinton, Clinton, North, Korea, China, Japan, Abe, Clinton, Egypt, Sisi, Clinton, Sisi, Trump, Sisi, Monday, New, York, US, Egypt, Trump, Sen., Jeff, Sessions, Alabama, Lt., Gen., Michael, Flynn, Trump, Trump, Mr., Trump, President, Egypt, Trump, United, America, Egypt, Trump, Republican, Muslim, Muslims, U.S., Islam, Muslims, Trump, US-Egypt, Middle, East, Sisi, Trump, Mexican, Mexico, Poroshenko, Clinton, Ukraine, Clinton, Clinton, Trump, Friday, White, House, Day, One, Clinton, Trump, Clinton, Trump, Mexican, President, Enrique, Peña, Nieto, Trump, Peña, Nieto, Trump, Mexico, Clinton, Trump, Trump, Donald, Trump, Clinton, Ohio, Clinton, Clinton, Poroshenko, Moscow, Clinton, Trump, Putin, US, Moscow, Crimea, Ukraine, Clinton, Washington, Ukraine, Kiev, Obama, Ukraine, Clinton, Clinton, Sisi, Middle, East, Egyptian, President, Obama, Clinton, Egypt, ISIS, Clinton, US, Aya, Hijazi, Egypt, Clinton, Monday, Egypt, Clinton, US, Egypt, Middle, East, Sisi, Muslim, Brotherhood, Egypt, Clinton, US, Egypt, Hosni, Mubarak, Obama, US, Sisi, Trump, Egypt, Clinton, August, Middle, East, Sisi, Clinton, Abe, Asia, North, Korea, Clinton, US, Japan, South, Korea, US, China, Pyongyang, Clinton, North, Korea, China, Abe, Trans-Pacific, Partnership, Clinton, US, Trump, GOP, US, Pyongyang",206,212,151,45,0,265,108,235,73,67,1,18
37,PolitiFact_Real_37,822,34,14.8,0,7,"Washington, CNN, Donald, Trump, Republican, Hillary, Clinton, Road, Hillary, Clinton, Clinton, CNN, Political, Director, David, Chalian, Iowa, Republican, Utah, Republican, Republican, Maine, District, Democrat, Nebraska, District, Republican, Road, College, Donald, Trump, Iowa, Barack, Obama, Republican, Trump, Florida, Nevada, Ohio, North, Carolina, Maine, Nebraska, Maine, Nebraska, Maine, Democrat, Nebraska, Republican, Utah, Republican, Trump, Trump, Clinton, Trump, Florida, Ohio, North, Carolina, Clinton, Pennsylvania, Colorado, Michigan, Virginia, Clinton, Trump, Brooklyn, HQ, Trump, Trump, Clinton, Trump, Clinton, Pennsylvania, Clinton, Keystone, State, Trump, Pennsylvania, Florida, Ohio, Clinton, Trump, Trump, Clinton, Republican, Alabama, Alaska, Arkansas, Idaho, Indiana, Kansas, Kentucky, Louisiana, Mississippi, Missouri, Montana, Nebraska, North, Dakota, Oklahoma, South, Carolina, South, Dakota, Tennessee, Texas, Utah, West, Virginia, Wyoming, Arizona, Georgia, Iowa, Florida, Nevada, Ohio, Maine, Congressional, District, Nebraska, Congressional, District, North, Carolina, Colorado, Michigan, New, Hampshire, Pennsylvania, Virginia, Wisconsin, Solid, California, Connecticut, Delaware, DC, Hawaii, Illinois, Maine, Maryland, Massachusetts, New, Jersey, New, York, Oregon, Rhode, Island, Vermont, Washington, Minnesota, New, Mexico",84,152,56,36,0,90,81,300,1044,873,1,3
38,PolitiFact_Real_38,1763,25,11.9,0,8,"CNN, North, Korea, Friday, US, Asia, Washington, US, People, Republic, Korea, Foreign, Minister, Ri, Yong, Ho, UN, General, Assembly, United, Ri, US, New, York, Friday, North, Korea, Tuesday, US, Pentagon, Wednesday, North, South, Korea, US-South, Korea, October, North, Korea, Pentagon, North, Korea, Gen., Joseph, Dunford, Joint, Chiefs, Staff, Wednesday, Maryland, United, DPRK, B-1B, South, Korea, Ri, United, Secretary, State, John, Kerry, Friday, UN, General, Assembly, Association, Southeast, Nations, United, Kerry, ASEAN, ASEAN, DPRK, Prime, Minister, Shinzo, Abe, UN, Wednesday, North, Korea, Abe, Japan, South, Korea, China, Washington, Beijing, South, China, Sea, Iran, North, Korea, People, Republic, Korea, US, October, North, Korea, US, Alison, Evans, IHS, North, Korea, Evans, Pentagon, Union, Concerned, Scientists, Pyongyang, October, Worker, Party, Korea, North, Korea, January, May, North, Korea, Kim, Jong-un, Pyongyang, WATCHED, US, B-1, South, Korea, Replay, Videos, MUST, WATCH, US, B-1, South, Korea, Pyongyang, September, DPRK, Tuesday, North, Korea, North, North, Korea, Johns, Hopkins, University, School, Advanced, International, US, President, Barack, Obama, United, North, Korea, Obama, US, UN, Security, Council, North, Korea, Obama, Donald, Trump, Kim, US, South, Korea, Japan, Japan, North, Korea, Trump, Anderson, Cooper, CNN, Milwaukee, March, South, Korea, Tokyo, Seoul, Trump, China, Beijing, Republican, US, Friday, South, Korea, U.S., U.S., Saturday, March, U.S., South, Hide, Caption, South, Korea, U.S., Clouds, March, South, Korea, U.S, Hide, Caption, South, Korea, U.S., A, South, Marine, March, Hide, Caption, South, Korea, U.S., A, South, Marine, March, Hide, Caption, South, Korea, U.S., A, South, Korea, March, Hide, Caption, South, Korea, U.S., Australia, New, Zealand, Saturday, Hide, Caption, South, Korea, U.S., Marines, March, Hide, Caption, South, Korea, U.S., March, Hide, Caption, South, Korea, U.S., South, Korea, U.S., March, Hide, Caption, Hillary, Clinton, China, North, Korea, US, International, March, January, North, Korea, North, Korea, Bruce, Klingner, Heritage, Foundation, UN, Iran, Klingner, North, Korea, WATCHED, General, North, Korea, Replay, Videos, MUST, WATCH, General, North, Korea, China, March, China, North, Korea, China, South, China, Sea, Dunford, Wednesday, China, Pacific, US, Pyongyang, Klingner, US, October, US, South, Korea, Alaska, Defense, Department, CNN, North, Korea, South, Korea, Red, Flag",210,339,164,58,0,237,158,325,8,8,1,63
39,PolitiFact_Real_39,349,10,6.3,0,9,"“, ”, –, Donald, Trump, Miami, Florida, Amendment, Amendment, Guns, ’, Every, Second, Amendment, EagleRising.com",41,15,33,25,2,75,31,46,26,21,1,28
40,PolitiFact_Real_40,413,15,5.7,0,18,"SHARES, Facebook, Twitter, America, *, Forget, Muslim, ’, ’, LA, Police, Commission, Are, Daily, Caller, –, Los, Angeles, Police, Commission, LAPD, Los, Angeles, Police, Protective, League, ’, Pandora, Box, LAPD, LAPD, ’, LAPD, *, ’",56,35,46,25,0,99,27,49,5,5,1,61
