NewsID,label,Text Length,Summary Length,Readability Score,Keyword Frequency,Title Length,Named Entities,num_nouns,num_propernouns,num_determinants,num_adverbs,num_interjections,num_verbs,num_adjectives,punctuation_count,TotalShares,UniqueUserShares,image_present,image_count
79,PolitiFact_Real_79,968,13,7.6,0,10,"Sen., Chuck, Schumer, ’, Florida, Ohio, Getty, Schumer, Senate, Chuck, Schumer, New, York, Senate, Tuesday, Story, Continued, Below, Schumer, Senatorial, Campaign, Committee, September, Schumer, Schumer, Kochs, ”, Senate, Minority, Leader, Harry, Reid, D-Nev., Monday, ”, Schumer, ’, Florida, Ohio, North, Carolina, Missouri, Senate, Schumer, Reid, Schumer, ’, ’, GOP, November, Schumer, DSCC, New, York, Senate, ”, New, York, Schumer, ”, DSCC, Schumer, Reid, Senate, Majority, PAC, PAC, Senate, Reid, Susan, McCue, Republican, PACs, Leader, Reid, Senator, Schumer, Senate, ”, McCue, Schumer, New, York, GOP, Schumer, Schumer, Schumer, ’, ’, ’, Senate, ”, Chuck, ”, Sen., Debbie, Stabenow, D-Mich., Schumer, Senate, ”, Stabenow, ’, DSCC, Schumer, New, Hampshire, Pennsylvania, Nevada, Florida, ”, Reid, National, Republican, Senatorial, Committee, DSCC, Senate, Leadership, Fund, Republican, McConnell, Sen., John, Thune, R-S.D, Thune, Schumer, ”, Thune, Sen., Richard, Shelby, Alabama, GOP, NRSC, Vice, Chairs, Dean, Heller, Nevada, Tom, Cotton, Arkansas, GOP, NRSC, Joni, Ernst, Iowa, Tuesday, Chuck, Schumer, Trump, Senate, Majority, Whip, John, Cornyn, Texas, Schumer, Texan",138,160,84,46,0,185,67,142,62,51,1,3
80,PolitiFact_Real_80,262,43,9.9,0,12,"Story, Transparent, Jill, Soloway, Donald, Trump, Emmys, Sunday, Soloway, Republican, CNN, Emmys, Sunday, Donald, Trump, Republican, Adolf, Hitler, Jill, Soloway, Amazon, Transparent, Variety, Trump, Nazi, Germany, Hitler, Donald, Trump, Muslims, O, Soloway, Jill, Soloway, Comedy, Series, Annual, Primetime, Emmy, Awards, Trump, Hitler, CNN, Trump",33,44,22,6,0,47,13,48,53,46,1,123
81,PolitiFact_Real_81,160,52,11.1,0,8,"Sept., Aleppo, Thaer, Mohammad/AFP/Getty, Images, ABC, News, A, Aleppo, Sept., Ameer, Alhalbi/AFP/Getty, Images, Syrians, Aleppo, Sept., Ameer, Alhalbi/AFP/Getty, A, Sept., Aleppo, Thaer, Mohammed/AFP/Getty, Images",30,25,23,0,0,18,18,30,5,5,1,7
82,PolitiFact_Real_82,1319,11,11.6,0,11,"NEW, YORK, –, All, America, ’, New, York, United, Nations, General, Assembly, Story, Continued, Below, Monday, Hillary, Clinton, President, Petro, Poroshenko—a, Vladimir, Putin, Donald, Trump, Prime, Minister, Shinzo, Abe, Sunday, China, North, Korea, Donald, Trump, ’, America, Japan, South, Korea, Clinton, Trump, President, Abdel, Fattah, American, Trump, ’, Sisi, Egypt, ’, Republican, Middle, East, Muslim, America, Prime, Minister, Benjamin, Netanyahu, Mitt, Romney, Obama, ’, Berlin, Trump, Clinton, Trump, November, ’, America, ”, Clinton, ’, ”, Certainly, ’, America, ’, ”, Sen., Ben, Cardin, D-Md, Foreign, Relations, Committee, “, Rep., Peter, King, R-N.Y., Homeland, Security, Committee, Trump, Trump, ’, Mexico, ’, America, ’, ’, Russian-led, WikiLeaks, Trump, Crimea, GOP, Prime, Minister, Matteo, Renzi, Clinton, Vice, President, Joe, Biden, Trump, ’, “, ”, NATO, Latvia, President, Barack, Obama, Friday, London, Mayor, Sadiq, Khan, Chicago, Trump, “, ”, ISIL, Clinton, ’, Mexican, President, Enrique, Peña, Nieto, NATO, Trump, China, Russia, North, Korea, Inauguration, Day, Washington, ’, Clinton, Trump, Trump, Jan., Poroshenko, Putin, Trump, ’, Secretary, Clinton, ’, Trump, U.S., ”, King, Clinton, Cardin, Obama, George, W., Bush, Cardin, Clinton, Harare, Zimbabwean, President, Robert, Mugabe, Trump, ’, Trump, ISIL, Sunni, Donald, Trump, ’, Muslims, America, Muslim, Cardin, ’, Obama, Trump, Obama, United, ”, Obama, Middle, East, Putin, Cuba, U.N., General, Assembly, Tuesday, Trump, ’, Mexico, White, House, Clinton, ’, White, House, ”, Ivo, Daalder, Chicago, Council, Global, Affairs, Obama, ’, U.S., NATO",193,229,114,58,0,257,106,144,48,46,1,3
83,PolitiFact_Real_83,339,28,8.2,0,9,"Manhattan, N.Y., “, No-one, ”, Cuomo, New, York, ”, Got, Sunday, ISIS, ”, Okay, –, Cuomo, ’, ISIS, THEM, ’, THEM, ISIS, ”, Governor, Cuomo, Obama, ’, Muslims, U.S., Manhattan, Islamist, Minnesota, Saturday, NYC, Mayor, Bill, de, Blasio, EagleRising.com",58,39,39,27,0,71,26,56,9,9,1,27
84,PolitiFact_Real_84,531,22,7.3,0,11,"SHARES, Facebook, Twitter, Hollywood, Clint, Eastwood, Republican, Donald, Trump, Hillary, Clinton, Hollywood, Donald, Trump, *, *, *, Gran, Torino, ’, Good, ‘, ”, Well, Clint, Eastwood, Donald, Trump, Donald, Trump, Trump, ’, Trump, Mexican, ’, Trump, Kick, Donald, Trump, Hillary, Clinton, Which, Eastwood, ’, Hollywood, Hollywood, A, ’, Mel, Gibson, Stacey, Dash, A, Hollywood, Clint, Eastwood",79,56,35,37,0,130,45,68,67,65,1,60
85,PolitiFact_Real_85,270,19,12.6,0,10,"Prime, Minister, Matteo, Renzi, President, Bill, Clinton, AP, Photo, Italian, Bill, Clinton, 'first, Prime, Minister, Matteo, Renzi, Monday, President, Bill, Clinton, G-7, May, Sicily, Renzi, ’, Clinton, Global, Initiative, Argentinean, President, Mario, Macri, London, Mayor, Sadiq, Khan, Ngozi, Okonjo-Iweala, Gavi, Vaccine, Alliance, Nigerian, Story, Continued, Below, “, Mr, President, ], ”, Renzi, Clinton, G-7, Italy, May, Sicily, G-7, G-7, ”, Macri, Clinton, Clinton, ’, Hillary, Clinton, White, House",32,68,23,12,0,38,28,38,21,19,1,3
86,PolitiFact_Real_86,946,14,12.8,0,8,"SHARES, SHARE, THIS, World, War, II, New, Yorker, Roger, Angell, Armageddon, Republican, Donald, Trump, My, Cuban, Axis, Continental, Europe, Imperial, Japan, Pacific, Rim, Solomon, Islands, Angell, Trump, ’, Second, World, War, August, Purple, Heart, Mr., Trump, “, Purple, Heart, Mr., Trump, Gardner, Normandy, Beach, Hürtgen, Forest, Aachen, Battle, Bulge, Neil, Belfort, Gap, American, Far, Trump, ’, Trump, Vietnam, Trump, –, Mr., Angell, Mr, Trump, How, ’, Mr., Angell, Hillary, Clinton, Hillary, Clinton, Ms., Clinton, President—at, President, Trump, White, House, Donald, Trump, White, House, President, Obama, West, Yemen, President, ’, President, Congress, President, ’, IMPEACH, DONALD, TRUMP",142,95,102,43,0,145,77,119,19,19,1,16
87,PolitiFact_Real_87,349,17,10.0,0,10,"Louisiana, Deputy, Derrick, Stafford, ’, Stafford, Stafford, [, Christopher, ], Few, Officers, Christopher, Few, Few, Jeremy, Few, Few, Jeremy, Stafford, Norris, Greenhouse, Few, Stafford, Greenhouse, Jeremy, Jeremy, Stafford, ’, Few, Jeremy, ’, Judge, William, Bennett, Louisiana, State, Police, Facebook",55,40,29,20,0,65,27,49,15,15,1,9
88,PolitiFact_Real_88,178,31,12.5,0,9,"Story, Trump, Tuesday, Miss, Universe, Alicia, Machado, Miss, Piggy, House, Trump, Washington, CNN, House, Speaker, Paul, Ryan, Tuesday, Donald, Trump, Miss, Universe, Hillary, Clinton, Fox, News, Tuesday, Miss, Universe, Alicia, Machado, Republican, Ryan, Trump, Ryan, Hillary, Donald, Trump, Donald, Trump, Ryan",20,40,17,8,0,34,15,32,56,52,1,18
89,PolitiFact_Real_89,412,18,10.2,0,8,"Donald, Trump, Snapchat, Republican, Monday, Hillary, Clinton, Snapchat, Debate, Day, Donald, J., Trump, Crooked, Hillary, Make, America, Great, Again, Say, Snap, Inc, Snapchat, Geofilters, Trump, Trump, Snapchat, Snap, Inc., Trump-Clinton, Trump, Clinton, Twitter, TWTR, Tech30, Facebook, FB, Tech30, Snapchat, Trump, Clinton, Trump, BernieSanders, @, Snapchat, @, HillaryClinton, —, Noah, Gray, @, NoahGrayCNN, January, Recent, Clinton, Clinton, Snapchat, Clinton, Trump, California, Clinton, Republican, National, Convention, Trump, Clinton, Bernie, Sanders, Clinton",66,68,43,17,0,64,30,81,201,190,1,12
90,PolitiFact_Real_90,497,4,9.7,0,10,"Ohio, Black, Matter, Attorney, Andrea, Burton, Youngstown, Ohio, July, Judge, Robert, Milich, New, York, Daily, News, Burton, Milich, WKBN, Supreme, Court, Video, Keith, Urban, ’, ”, Milich, WKBN, Burton, Video, Keith, Urban, New, York, Daily, News, Supreme, Court, Burton, NY, Daily, News, ’, Mike, Brickner, American, Civil, Liberties, Union, Ohio, Brickner, July, WKBN, ’",86,54,62,15,0,103,31,64,5,5,1,8
91,PolitiFact_Real_91,1348,22,12.0,0,13,"Former, President, Bill, Clinton, Clinton, Health, Access, Initiative, CHAI, HIV/AIDs, Africa, “, Daily, Caller, News, Foundation, Clinton, Foundation, India, Success, Story, ”, Rep., Marsha, Blackburn, Tennessee, Republican, House, Energy, Commerce, Committee, CHAI, AIDS, Clinton, Foundation, ’, Clinton, ’, Ranbaxy, CHAI, HIV/AIDS, Third, World, Dinesh, Thakur, Ranbaxy, U.S., U.S., U.S., Ranbaxy, Department, Justice, District, Maryland, ’, ”, U.S., Attorney, District, Maryland, Rod, J., Rosenstein, Ranbaxy, FDA, ’, ”, Stuart, F., Delery, Department, Justice, Department, Justice, “, ’, ’, ”, ’, ”, Blackburn, TheDCNF, CHAI, AIDS, Third, World, Clinton, Hillary, Clinton, ’, Blackburn, Department, Health, Human, Department, State, Hillary, President, Barack, Obama, ’, Bill, Food, Drug, Administration, FDA, Exchange, Commission, Clinton, Foundation, ’, Ranbaxy, FDA, AIDS, ProPublica, U.S., Agency, International, Development, Ranbaxy, “, ”, “, Substandard, HIV, ”, Roger, Bate, American, Enterprise, Institute, TheDCNF, Thakur, TheDCNF, ’, AIDS, WBC, Ranbaxy, ’, August, CHAI, World, Health, Organization, Ranbaxy, South, Africa, FDA, Ranbaxy, ’, HIV/AIDs, “, Ranbaxy, ’, U.S., CHAI, Ranbaxy, ’, HIV/AID, Bill, Ranbaxy, Mumbai, CHAI, Clinton, Foundation, Ranbaxy, Thakur, “, CHAI, Clinton, Foundation, TheDCNF, Clinton, Foundation., ”, CHAI, Clinton, Foundation, Bill, Clinton, Charles, Ortel, Wall, Street, Clinton, Foundation, ”, Bill, Clinton, ‘, CHAI, ’, Foundation, ”, Ortel, TheDCNF, Bill, U.S., “, HIV/AIDS, CHAI, October, HIV, Ranbaxy, Cipla, Mumbai, India, Matrix, Labs, Hydrabad, India, Aspen, Pharmacare, Johannesburg, South, Africa, CHAI, ’, Ranbaxy, HIV, U.S., President, ’, Emergency, Plan, AIDS, President, George, W., Bush, U.S., Clinton, ’, Ranbaxy, FDA, HIV, Foundation, Clinton-CHAI, Clinton, Foundation, Indian, Foundation, Clinton, Rajat, Gupta, Vinod, Gupta, Rajat, Vinod, CEO, InfoGroup, Securities, Exchange, Commission, Vinod, Bill, Blackburn, Clinton, Foundation, EagleRising.com",188,260,152,44,0,230,111,178,32,31,1,28
92,PolitiFact_Real_92,5292,17,10.8,0,6,"Donald, Trump, Donald, Trump, America, Donald, Trump, Muslims, Merry, Christmas, Donald, Trump, Chris, Cox, Bikers, Trump, Pensacola, Story, Continued, Trump, Wrestlemania, Donald, J., Trump, Church, Cultural, Resentment, Crooked, Hillary, Clinton, Barack, Obama—, “, President, Obama, Trump, Clinton, ’, ’, Tonight, Hillary, Clinton, Donald, Trump, Trump, Clinton, “, Love, Trumps, Hate, ”, “, Stronger, Together., Temple, University, Philadelphia, Orlando—and, Glenn, McCoy, Catholic, Hil, Clinton, ’, Orlando, ’, ”, Clinton, Trump, Trump, NASCAR, Chinese, Islamic, Clinton, ’, ’, Federal, Reserve, FBI, Clinton, NAFTA, Clinton, ’, Benghazi, Trump, ’, Clinton, ’, Donald, J., Trump, Clinton, ’, “, Trump, ’, Clinton, Miami, Clinton, Bom, Bom, Bom, Trump, See, ”, Many, Bom-Bom-Bom-See-Ya, Trump, ’, *, Trump, Pensacola, Republican, January, Ted, Cruz, ’, Star, Spangled, Banner, Trump, Trump, U.S., “, ”, “, Common, Core, ’, Dream, ’, Don, ’, Don, ’, Trump, Pensacola, ’, Trump, That, Bitch, Trump, Confederate, Tyranny, LOCK, HER, UP, Trump, ”, Trump, Muslim, Maybe, Merry, Christmas, ”, Trump, January, Republican, ”, “, Trump, Trump, Trump, World, War, Clinton, “, George, W., Bush, “, ”, ’, OK, Vladimir, Putin—and, ’, Russia, ’, Trump, ”, Trump, Asheville, N.C., Trump, U.S., ”, Jim, Crow—was, “, Trump, Associated, Press, Clinton, “, Restraint, Clinton, Health, Shows, New, Campaign, Discipline., ”, Predictably, Trump, Clinton, ’, White, House, ’, Trump, P, ’, Q, ’, ”, Alan, Smith, Gulf, Breeze, Bill, Turpin, Army, Brayton, Iowa, Trump, Des, Moines, Clinton, ’, ”, Again, Trump, Black, Matter, ”, Norris, Westfall, Infowars, Liberty, Death, Trump, Asheville, N.C., Muslim, Merry, Christmas, ’, Trump, Trump, Obama, Obama, Islamophobia, Islamic, Asheville, Air, Force, Gary, Latham, Lazy, America, Carolina, ”, Clinton, “, Trump, Obama, Obama, Trump, Asheville, ”, Kim, Buckner, Don, ’, Tread, Me, Asheville, Trump, Screw, Trump, Trump, Trump, Trump, ’, Trump, Trump, Obama, Kenya—and, ’, Muslim, ISIS, Richard, Cohen, Asheville, Cohen, Trump, Trump, N-word, Cohen, Trump, ”, Cohen, Obviously, ’, Clinton, First, Lady, Secretary, State, Senate, New, York, White, House, Democrat, Republican, New, Yorkers, Senate, Clinton, Trump, ’, *, *, Nearly, Clinton, ’, Orlando, Inclusive, Economy, ”, I-4, Clinton, Trump, America, Election, Day, Clinton, ’, ”, Lewis, Smith, Orlando, Clinton, Charlotte, Alzheimer, ’, Clinton, ”, Maybe, Hillary, Clinton, United, America, ”, Clinton, Clinton, Children, ’, Defense, Fund, State, Department, ’, ”, Christopher, Reeve, ”, Trump, Trump, Obamacare, “, Federal, Reserve, Justice, Department, Clinton, ’, Cable, Trump, Don, King, Clinton, ’, Trump, Trump, ’, Geannie, Bastian, Trump, Believe, ”, Trump, ”, Clinton, Joe, Kilsheimer, Florida, Eagle, Scout, Down, ’, Syndrome, Hillary, ”, Kilsheimer, ”, Geannie, Bastian, University, Central, Florida, Clinton, ’, Trump, Believe, ”, Trump, Trump, Clinton, Trump, ’, American, ”, Betty, Edwards, Orlando, ”, Many, Trump, ’, Andy, Gutierrez, Puerto, Rican, Boricua, Vota, Orlando, Trump, ”, Gutierrez, People, Hillary, Trump., ”, Clinton, ’, Philadelphia, Bernie, Sanders, OK, ”, Thomas, Davidenko, Temple, My, Trump, ’, Orlando, Clinton, Lou, Smith, AT, T, Trump—and, ”, Clinton, Republican, ’, Obama, ’, Bush, Bill, Clinton, Obama, ”, Jeneka, Lloyd, Orlando, Man, Hillary, Trump, Republican, ’, Bush, Obama, Fox, News, Trump, ’, Gold, Star, Donald, Trump, Clinton, *, *, Tonight, Long, Island, Trump, Clinton, Trump, Lester, Holt, Trump, ’, Trump, ’, Trump, Obama, ’, Wall, Street, Obama, Trump, Oval, Office, ’, ’, ’, Clinton, ’, ’, Trump, Trump, Clinton, Trump, Kabuki, Trump, Trump, Michael, Grunwald, Politico, Magazine",863,537,490,260,3,1032,560,710,34,22,1,3
93,PolitiFact_Real_93,302,29,6.5,0,10,"HBO, ’, Time, Bill, Maher, –, Donald, Trump, –, Trump, Israel, Donald, Trump, TSA, Israel, TSA, ’, TSA, Dumb, EagleRising.com",50,20,29,26,0,72,28,48,26,24,1,28
94,PolitiFact_Real_94,1068,42,9.7,0,9,"New, York, CNN, Hillary, Clinton, Donald, Trump, Florida, Wednesday, Pennsylvania, Monday, Clinton, Trump, Monday, Hofstra, University, Clinton, New, York, New, Jersey, Trump, Clinton, Trump, Trump, Bill, Clinton, Tuesday, Hillary, Clinton, Sleep, Hillary, WATCHED, Replay, Videos, MUST, WATCH, Clinton, Tuesday, Trump, Clinton, Tuesday, Steve, Harvey, Radio, Steve, Trump, Clinton, Clinton, Trump, Republican, Ted, Cruz, Trump, Clinton, Clinton, August, Clinton, Ron, Klain, Obama, Karen, Dunn, Chappaqua, New, York, Monday, Clinton, Trump, Tony, Schwartz, Art, Deal, Trump, Clinton, Trump, GOP, Brian, Fallon, Clinton, August, Senate, Barack, Obama, Bernie, Sanders, Trump, Clinton, Clinton, Senate, Rick, Lazio, Republican, Lazio, Clinton, November, WATCHED, Debate, Replay, Videos, MUST, WATCH, Debate, Her, Democratic, Party, Clinton, Clinton, New, York, September, Wall, Street, Vermont, Sen., Bernie, Sanders, Trump, Clinton, Clinton, Clinton, Trump, Clinton, Trump, Hofstra, Donald, Trump, Clinton, August, New, York",156,133,89,37,0,188,57,172,347,324,1,7
95,PolitiFact_Real_95,1481,31,7.9,0,7,"KALLSTADT, Germany, —, Few, Germany, ’, Kallstadt, U.S., Republican, Donald, Trump, ’, Frankfurt, Kallstadt, Saumagenkerwe, Germany, Trump, Pew, Research, Center, Johannes, Steiniger, Trump, Hillary, Clinton, Trump, Steiniger, POLITICO, Trump, ’, Kallstadt, ”, Sarah, Bühler, Saumagenkerwe, ’, Bühler, “, ’, ”, Bühler, Pink, ’, ”, Tanja, Huber, Trump, Kallstadt, ’, t, Trump, ”, Huber, ”, *, *, *, Donald, ’, Friedrich, Trump, Kallstadt, March, Trump, Trump, ”, “, Dromb, ”, “, Trumpff, ”, Drumpf, ”, Gwenda, Blair, Friedrich, “, Trump., ”, Germany, Kallstadt, Palatinate, Kingdom, Friedrich, ’, Friedrich, Katharina, United, New, York, Eider, October, U.S., Bavaria, ”, Roland, Paul, Institute, Palatinate, Regional, History, Folklife, Kaiserslautern, Paul, Friedrich, U.S, Friedrich, Palatinate, Blair, Kallstadt, Elisabeth, Christ, Friedrich, August, New, York, Friedrich, U.S., America, Donald, Trump, ’, American-born, John, Walter, Simone, Wendel, Friedrich, Kallstadt, United, U.S., Blair, ’, Kallstadt, Friedrich, February, Kallstadt, Friedrich, May, ”, Friedrich, —, Pennsylvania, July, New, York, Donald, ’, Fred, Trump, Junior, ], ‘, ”, Walter, America, ’, Donald, ”, Friedrich, —, Frederick, —, May, Kallstadt, *, *, February, Simone, Wendel, Kallstadt, Donald, Trump, Kings, Kallstadt, Donald, Trump, Henry, John, Heinz, Heinz, Ketchup, Wendel, Trump, Walter, Trump, ’, Kallstadt, Wendel, Walter, Trump, Tower, ’, Linzer, Walter, Trump, Trump, ’, Hello, John, ”, Trump, ’, Wendel, Trump, Boeing, New, York, ’, Central, Park, Wendel, Afterwards, Trump, Wendel, Trump, U.S., World, Wars, Wendel, Kallstadt, ”, “, Wow, ”, Trump, Walter, Wendel, Trump, Tower, Trump, ’, Eric, Trump, Kallstadt, ”, Wendel, Kallstadt, ”, Trump, Junior, “, No",256,244,130,57,0,272,117,246,31,26,1,15
96,PolitiFact_Real_96,410,21,7.3,0,8,"Hollywood, Chicago, Illinois, December, Liesl, Von, Trapp, “, Sound, Music., ”, Charmian, Carr, Hollywood, TMZ, Sunday, September, Carr, ’, Carr, ’, “, Sound, Music, ”, San, Fernando, Valley, State, College, Robert, Wise, Sound, Music, Liesl, Mr, Music, ”, Carr, Charmian, Carr, Designs, ”, –, Michael, Jackson, Carr, Jay, Brent, Please, RIP, CHARMIAN, CARR",58,55,35,16,0,78,20,43,5,5,1,50
97,PolitiFact_Real_97,2109,20,9.3,0,3,"Panic, ’, ”, Story, Continued, Below, White, House, Barack, Obama, George, W., Bush, Obama, Bush, Donald, Trump, Hillary, Clinton, ’, James, Buchanan, ’, Franklin, Pierce, ’, Washington, Lincoln, Cal, Coolidge, Buchanan, Pennsylvania, America, ’, Buchanan, Panic, Europe, Bank, United, President, James, Knox, Polk, Oregon, California, Texas, West, Europe, Buchanan, Congress, Tariff, Bill, Dred, Scott, Supreme, Court, Buchanan, Roger, Taney, Supreme, Court, Buchanan, Dickinson, College, Scott, Missouri, Northwest, Scott, Buchanan, Union, Buchanan, Taney, Appeals, Court, Buchanan, Robert, Cooper, Grier, Dickinson, Pennsylvania, Taney, New, York, Justice, Samuel, Nelson, Legend, Taney, Capitol, Buchanan, Buchanan, Buchanan, Taney, Scott, Constitution, Fugitive, Slave, Law, Dred, Scott, Taney, Buchanan, West, Reading, Uncle, Pennybags, Monopoly, Reading, Railroad, Illinois, Central, Delaware, Lackawanna, Western, Fond, Lac, Railroad, Wisconsin, Senator, William, Seward, Republican, Party, Illinois, Central, Democrat, Stephen, Douglas, New, York, City, New, York, N.H., Wolfe, Co., August, Ohio, Life, Insurance, Trust, Co., Buchanan, Calm, Dred, Scott, West, Buchanan, Dred, Scott, Northern, South, Europe, North, South, Buchanan, Buchanan, ’, December, Panic, ’, ”, Buchanan, Kansas, Buchanan, John, Brown, Brown, Harpers, Ferry, West, Virginia, Washington, Potomac, Buchanan, Robert, E., Lee, Arlington, Texas, Lee, Harpers, Ferry, Brown, Buchanan, Utah, Mormon, William, Walker, ’, Nicaragua, Guatemala, Paraguay, Pig, War, San, Juan, Northwest, Hudson, Bay, Co., Buchanan, Kansas, U.S., Army, Buchanan, Democrat, Stephen, Douglas, ’, Republican, Abraham, Lincoln, Southern, Lincoln, ’, March, Buchanan, ’, Buchanan, Constitution, Buchanan, Cabinet, Southern, President, John, Tyler, Confederate, Buchanan, South, Fort, Sumter, Enter, Lincoln, Lincoln, James, Buchanan, “, Worst, President, Abe, Lincoln, George, W., Bush, Iraq, War, Crash, ’, Great, Recession, Obama, Honest, Abe, President, Hillary, Clinton, President, Donald, Trump, Robert, Strauss, Worst, President, James, Buchanan, POTUS, Rating, Game, Legacy, Least, Lesser",281,277,244,110,1,333,140,297,66,58,1,3
98,PolitiFact_Real_98,227,20,11.8,0,8,"Story, Trump, Trump, Cleveland, Heights, Ohio, CNN, Don, King, N-word, Donald, Trump, Wednesday, King, *, *, *, *, *, King, Trump, King, Michael, Cohen, Darrell, Scott, Trump, Trump, King",31,29,21,13,0,50,15,57,58,54,1,93
99,PolitiFact_Real_99,259,53,6.2,0,8,"Donald, Trump, Jr., Republican, Twitter, Monday, Skittles, America, —, Donald, Trump, Jr., @, DonaldJTrumpJr, September, Trump, Mars, Inc., Skittles, Skittles, ”, —, Mars, Incorporated, @, MarsGlobal, September, Hillary, Clinton, ’, Nick, Merrill, Trump, —, Nick, Merrill, @, NickMerrill, September, White, House, U.S., Syria, ’, Syria, Donald, Trump, Sr.",39,50,28,5,0,53,21,73,119,110,1,4
100,PolitiFact_Real_100,197,32,11.8,0,9,"Story, House, Oversight, Bryan, Pagliano, Pagliano, Clinton, Washington, CNN, House, Oversight, Government, Reform, Committee, Thursday, Hillary, Clinton, Bryan, Pagliano, Clinton, State, Department, Pagliano, House, Oversight, Chairman, Jason, Chaffetz, Utah, Republican, Clinton, IT, Justin, Cooper, Pagliano, Mr., Pagliano, Secretary, Clinton, Chaffetz, Mr., Pagliano",29,42,18,3,0,36,14,34,64,61,1,21
101,PolitiFact_Real_101,373,21,6.7,0,14,"Jean, Shepard, Jean, Shepard, Grand, Ole, Opry, ’, Shepard, “, Grand, Lady, ”, Opry, Grand, Lady, Country, Music, Hall, Fame, ’, Women, Country, Grand, Ole, Opry, Grand, Ole, Opry, …I, Isn, ’, Grand, Lady, Parkinson, ’, September, Jean, ’, Jean, Ollie, Imogene, Shepard, Oklahoma, Visalia, California, Hank, Thompson, Melody, Ranch, Girls, Thompson, Capitol, Records, Shepard, ’, ‘, Jean, Grand, Lady, Please, RIP, JEAN, SHEPARD",54,63,33,21,0,62,22,32,5,5,1,49
102,PolitiFact_Real_102,2146,18,9.8,0,8,"Confederate, Franklin, County, Courthouse, Confederate, ”, Linda, Stanley, Franklin, County, Historical, Society, Rocky, Mount, Virginia, Roanoke, ’, ”, Story, Continued, Confederate, Dylann, Roof, Charleston, South, Carolina, Confederate, Confederate, South, Carolina, South, Carolina, ’, Franklin, County, Virginia, Confederacy, Confederate, Virginia, “, New, South, ”, Old, Dominion, ’, Quinnipiac, University, Virginians, ’, Confederate, Danville, Virginia, ’, Confederate, Sutherlin, Mansion—known, Capitol, Confederacy—Confederate, Virginia, Franklin, County, January, Southern, Charles, Poindexter, General, Assembly, ”, Poindexter, Virginia, Legislature, March, Governor, Terry, McAuliffe, Confederate, ’, ”, Edward, Ayers, University, Richmond, Civil, War, ”, *, *, *, Mark, Whitaker, Confederate, Portsmouth, Virginia, ”, Whitaker, City, Council, Olde, Towne, ], Confederate, Civil, War, Reconstruction, South, Jim, Crow, Ku, Klux, Klan, Granite, Whitaker, Portsmouth, ’, Fred, Taylor, Confederate, Danville, Danville, Portsmouth, ”, Taylor, Virginia, Danville, Taylor, Virginia, Supreme, Court, Portsmouth, Whitaker, Portsmouth, City, Council, Danville, November, ”, *, *, *, Virginia, May, Charlottesville, Blue, Ribbon, Commission, Race, Memorials, Public, Spaces, Robert, E., Lee, Mayor, Mike, Signer, ’, Confederate, Signer, Charlottesville, “, City, Council, December, Alexandria, Appomattox, Old, Town, Confederate, United, Confederacy, Virginia, General, Assembly, Appomattox, Confederate, Virginia, Regiment, Union, Black, Matter, ”, Confederate, President, Jefferson, Davis, Richmond, Virginia, June, AP, Photo, Richmond, Confederacy, Confederate, June, Black, Matter, ”, Confederate, President, Jefferson, Davis, Mayor, Dwight, Jones, Arthur, Ashe, Richmond, Rather, Virginia, ’, ”, Jones, Delegate, Poindexter, Jones, Confederate, ’, Confederate, ”, Ayers, Confederate, South, United, Ayers, ”, *, *, *, Franklin, County, Stanley, Confederate, War, Between, States., ”, United, Confederacy, Booker, T., Washington, Franklin, County, Confederate, Stanley, Washington, “, ”, Poindexter, Franklin, County, “, Civil, War, Reconstruction, Franklin, County, Poindexter, Christian, A, National, Rifle, Association, General, Assembly, ’, Republican, Poindexter, ’, Stanley, Confederate, NAACP, Booker, T., Washington, ’, Civil, War, Civil, War, Roanoke, Landon, Howard, Visit, Virginia, ’, Blue, Ridge, Civil, War, ”, Yet, Franklin, County, Historical, Society, Memorial, Day, ’, “, Special, War, Between, ”, Confederate, General, Jubal, Early, Franklin, County, Lost, Cause, Confederate, ”, Jubal, A, Homeplace, Franklin, County, Poindexter, ’, ”, Lisa, Rab, Charlotte, N.C, Mother, Jones, Village, Voice, @",325,335,266,69,0,394,161,284,36,36,1,3
